### ISSUE TITLE
[BUG]

### ISSUE THREAD

**Issue by Lt-Flash** [OpenSIPS/opensips#2810]
**OpenSIPS version you are running**
```
version: opensips 3.2.4 (x86_64/linux)
flags: STATS: On, DISABLE_NAGLE, USE_MCAST, SHM_MMAP, PKG_MALLOC, Q_MALLOC, F_MALLOC, HP_MALLOC, DBG_MALLOC, FAST_LOCK-FUTEX-ADAPTIVE_WAIT
ADAPTIVE_WAIT_LOOPS=1024, MAX_RECV_BUFFER_SIZE 262144, MAX_LISTEN 16, MAX_URI_SIZE 1024, BUF_SIZE 65535
poll method support: poll, epoll, sigio_rt, select.
git revision: 50407d340
main.c compiled on 03:02:10 Feb 14 2022 with gcc 9
```

**Describe the bug**
When completing SIP REFER method NOTIFY packets are routed in incorrect order.

**To Reproduce**
1. Configure OpenSIPS to accept UDP connections using 'socket=udp:X.X.X.X:5060'
2. Create a simple routing script that forwards SIP packets to another server with a simple 'sethostport' command
3. Make a call to remote server - make sure it's answered successfully
4. Initiate a blind call transfer from user agent (MicroSIP in my case)
5. Observe SIP server sending two NOTIFY SIP packets, first one with CSeq 23563 and body '100 Trying' and immediately another one with CSeq 23564 and body '180 Ringing'
6. OpenSIPS sends these packets to SIP UA (MicroSIP) in reverse order - first goes CSeq 23564 '180 Ringing' and then CSeq 23563 '100 Trying'
7. MicroSIP responds to SIP packet with CSeq 23564 first and sends 200 OK
8. MicroSIP responds to SIP packet with CSeq 23563 second and sends 'Invalid CSeq'
9. SIP server can't properly terminate the call.

**Expected behavior**
Packets should be routed in the same order as they were sent from the SIP server.

**Relevant System Logs**
```
18:11:20.188606 IP MICROSIP_PUBLIC.52567 > OPENSIPS_PUBLIC.7060: UDP, bad length 1851 > 1448
INVITE sip:1XXXXX@DOMAIN.COM:7060 SIP/2.0
Via: SIP/2.0/UDP MICROSIP_PUBLIC:52567;rport;branch=z9hG4bKPj46bffa23943941f1bd0a94775b01ed7d
Max-Forwards: 70
From: <sip:USER@MICROSIP_PUBLIC>;tag=5ce39dca015745f7bf6847e790a8f7f2
To: <sip:1XXXXX@DOMAIN.COM>
Contact: <sip:USER@MICROSIP_PUBLIC:52567;ob>;+sip.ice
Call-ID: b6870e28eef04b3887ab0c8d715072a1
CSeq: 6724 INVITE
Allow: PRACK, INVITE, ACK, BYE, CANCEL, UPDATE, INFO, SUBSCRIBE, NOTIFY, REFER, MESSAGE, OPTIONS
Supported: replaces, 100rel, timer, norefersub
Session-Expires: 1800
Min-SE: 90
User-Agent: MicroSIP/3.20.7
Content-Type: application/sdp
Content-Length:   833

v=0
o=- 3859035080 3859035080 IN IP4 MICROSIP_PUBLIC
s=pjmedia
b=AS:84
t=0 0
a=X-nat:6
m=audio 4009 RTP/AVP 0 101
c=IN IP4 MICROSIP_PUBLIC
b=TIAS:64000
a=rtcp:4002 IN IP4 MICROSIP_PUBLIC
a=sendrecv
a=rtpmap:0 PCMU/8000
a=rtpmap:101 telephone-event/8000
a=fmtp:101 0-16
a=ssrc:438441613 cname:1b374d906edd739a
a=ice-ufrag:25cc3d0d
a=ice-pwd:6fea0a260ced1255124e7580
a=candidate:Sc0a80101 1 UDP 1862270975 MICROSIP_PUBLIC 4009


18:11:20.188800 IP OPENSIPS_PUBLIC.7060 > MICROSIP_PUBLIC.52567: UDP, length 404
SIP/2.0 100 Giving it a try
Via: SIP/2.0/UDP MICROSIP_PUBLIC:52567;received=MICROSIP_PUBLIC;rport=52567;branch=z9hG4bKPj46bffa23943941f1bd0a94775b01ed7d
To: <sip:1XXXXX@DOMAIN.COM>
From: <sip:USER@MICROSIP_PUBLIC>;tag=5ce39dca015745f7bf6847e790a8f7f2
Call-ID: b6870e28eef04b3887ab0c8d715072a1
CSeq: 6724 INVITE
Server: OpenSIPS (3.2.4 (x86_64/linux))
Content-Length: 0


18:11:20.190835 IP OPENSIPS_PRIVATE.5060 > SIPSERVER_PRIVATE.7060: SIP: INVITE sip:1XXXXXX@SIPSERVER_PRIVATE:7060 SIP/2.0
INVITE sip:1XXXXXX@SIPSERVER_PRIVATE:7060 SIP/2.0
Record-Route: <sip:OPENSIPS_PRIVATE;r2=on;lr;ftag=5ce39dca015745f7bf6847e790a8f7f2;did=574.c4e57d47>
Record-Route: <sip:OPENSIPS_PUBLIC:7060;r2=on;lr;ftag=5ce39dca015745f7bf6847e790a8f7f2;did=574.c4e57d47>
Via: SIP/2.0/UDP OPENSIPS_PRIVATE:5060;branch=z9hG4bK11fa.b18e7683.0
Via: SIP/2.0/UDP MICROSIP_PUBLIC:52567;received=MICROSIP_PUBLIC;rport=52567;branch=z9hG4bKPj46bffa23943941f1bd0a94775b01ed7d
Max-Forwards: 69
From: <sip:USER@MICROSIP_PUBLIC>;tag=5ce39dca015745f7bf6847e790a8f7f2
To: <sip:1XXXXX@DOMAIN.COM>
Contact: <sip:USER@MICROSIP_PUBLIC:52567;ob>;+sip.ice
Call-ID: b6870e28eef04b3887ab0c8d715072a1
CSeq: 6724 INVITE
Allow: PRACK, INVITE, ACK, BYE, CANCEL, UPDATE, INFO, SUBSCRIBE, NOTIFY, REFER, MESSAGE, OPTIONS
Supported: replaces, 100rel, timer, norefersub
Session-Expires: 1800
Min-SE: 90
User-Agent: MicroSIP/3.20.7
Content-Type: application/sdp
Content-Length: 297

v=0
o=- 3859035080 3859035080 IN IP4 OPENSIPS_PRIVATE
s=pjmedia
b=AS:84
t=0 0
a=X-nat:6
m=audio 36214 RTP/AVP 0 101
c=IN IP4 OPENSIPS_PRIVATE
b=TIAS:64000
a=ssrc:438441613 c


18:11:20.194358 IP SIPSERVER_PRIVATE.7060 > OPENSIPS_PRIVATE.5060: SIP: SIP/2.0 100 Trying
SIP/2.0 100 Trying
Via: SIP/2.0/UDP OPENSIPS_PRIVATE:5060;rport=5060;received=OPENSIPS_PRIVATE;branch=z9hG4bK11fa.b18e7683.0
Via: SIP/2.0/UDP MICROSIP_PUBLIC:52567;rport=52567;received=MICROSIP_PUBLIC;branch=z9hG4bKPj46bffa23943941f1bd0a94775b01ed7d
Record-Route: <sip:OPENSIPS_PRIVATE;lr;r2=on;ftag=5ce39dca015745f7bf6847e790a8f7f2;did=574.c4e57d47>
Record-Route: <sip:OPENSIPS_PUBLIC:7060;lr;r2=on;ftag=5ce39dca015745f7bf6847e790a8f7f2;did=574.c4e57d47>
Call-ID: b6870e28eef04b3887ab0c8d715072a1
From: <sip:USER@MICROSIP_PUBLIC>;tag=5ce39dca015745f7bf6847e790a8f7f2
To: <sip:1XXXXX@DOMAIN.COM>
CSeq: 6724 INVITE
Server: SERVER_VER
Content-Length:  0


18:11:20.203618 IP SIPSERVER_PRIVATE.7060 > OPENSIPS_PRIVATE.5060: SIP: SIP/2.0 180 Ringing
SIP/2.0 180 Ringing
Via: SIP/2.0/UDP OPENSIPS_PRIVATE:5060;rport=5060;received=OPENSIPS_PRIVATE;branch=z9hG4bK11fa.b18e7683.0
Via: SIP/2.0/UDP MICROSIP_PUBLIC:52567;rport=52567;received=MICROSIP_PUBLIC;branch=z9hG4bKPj46bffa23943941f1bd0a94775b01ed7d
Record-Route: <sip:OPENSIPS_PRIVATE;lr;r2=on;ftag=5ce39dca015745f7bf6847e790a8f7f2;did=574.c4e57d47>
Record-Route: <sip:OPENSIPS_PUBLIC:7060;lr;r2=on;ftag=5ce39dca015745f7bf6847e790a8f7f2;did=574.c4e57d47>
Call-ID: b6870e28eef04b3887ab0c8d715072a1
From: <sip:USER@MICROSIP_PUBLIC>;tag=5ce39dca015745f7bf6847e790a8f7f2
To: <sip:1XXXXX@DOMAIN.COM>;tag=3be4778d-637c-4c9a-88df-59c90c351d8f
CSeq: 6724 INVITE
Server: SERVER_VER
Contact: <sip:SIPSERVER_PRIVATE:7060>
Allow: OPTIONS, REGISTER, SUBSCRIBE, NOTIFY, PUBLISH, INVITE, ACK, BYE, CANCEL, UPDATE, PRACK, MESSAGE, REFER
P-Asserted-Identity: <sip:611XXXXX@DOMAIN.COM>
Remote-Party-ID: <sip:611XXXXX@DOMAIN.COM>;party=called;privacy=off;screen=no
Content-Length:  0


18:11:20.204222 IP OPENSIPS_PUBLIC.7060 > MICROSIP_PUBLIC.52567: UDP, length 927
SIP/2.0 180 Ringing
Via: SIP/2.0/UDP MICROSIP_PUBLIC:52567;rport=52567;received=MICROSIP_PUBLIC;branch=z9hG4bKPj46bffa23943941f1bd0a94775b01ed7d
Record-Route: <sip:OPENSIPS_PRIVATE;lr;r2=on;ftag=5ce39dca015745f7bf6847e790a8f7f2;did=574.c4e57d47>
Record-Route: <sip:OPENSIPS_PUBLIC:7060;lr;r2=on;ftag=5ce39dca015745f7bf6847e790a8f7f2;did=574.c4e57d47>
Call-ID: b6870e28eef04b3887ab0c8d715072a1
From: <sip:USER@MICROSIP_PUBLIC>;tag=5ce39dca015745f7bf6847e790a8f7f2
To: <sip:1XXXXX@DOMAIN.COM>;tag=3be4778d-637c-4c9a-88df-59c90c351d8f
CSeq: 6724 INVITE
Server: SERVER_VER
Contact: <sip:SIPSERVER_PRIVATE:7060>
Allow: OPTIONS, REGISTER, SUBSCRIBE, NOTIFY, PUBLISH, INVITE, ACK, BYE, CANCEL, UPDATE, PRACK, MESSAGE, REFER
P-Asserted-Identity: <sip:611XXXXX@DOMAIN.COM>
Remote-Party-ID: <sip:611XXXXX@DOMAIN.COM>;party=called;privacy=off;screen=no
Content-Length:  0


18:11:21.889891 IP SIPSERVER_PRIVATE.7060 > OPENSIPS_PRIVATE.5060: SIP: SIP/2.0 183 Session Progress
SIP/2.0 183 Session Progress
Via: SIP/2.0/UDP OPENSIPS_PRIVATE:5060;rport=5060;received=OPENSIPS_PRIVATE;branch=z9hG4bK11fa.b18e7683.0
Via: SIP/2.0/UDP MICROSIP_PUBLIC:52567;rport=52567;received=MICROSIP_PUBLIC;branch=z9hG4bKPj46bffa23943941f1bd0a94775b01ed7d
Record-Route: <sip:OPENSIPS_PRIVATE;lr;r2=on;ftag=5ce39dca015745f7bf6847e790a8f7f2;did=574.c4e57d47>
Record-Route: <sip:OPENSIPS_PUBLIC:7060;lr;r2=on;ftag=5ce39dca015745f7bf6847e790a8f7f2;did=574.c4e57d47>
Call-ID: b6870e28eef04b3887ab0c8d715072a1
From: <sip:USER@MICROSIP_PUBLIC>;tag=5ce39dca015745f7bf6847e790a8f7f2
To: <sip:1XXXXX@DOMAIN.COM>;tag=3be4778d-637c-4c9a-88df-59c90c351d8f
CSeq: 6724 INVITE
Server: SERVER_VER
Allow: OPTIONS, REGISTER, SUBSCRIBE, NOTIFY, PUBLISH, INVITE, ACK, BYE, CANCEL, UPDATE, PRACK, MESSAGE, REFER
Contact: <sip:SIPSERVER_PRIVATE:7060>
P-Asserted-Identity: <sip:611XXXXX@DOMAIN.COM>
Remote-Party-ID: <sip:611XXXXX@DOMAIN.COM>;party=called;privacy=off;screen=no
Content-Type: application/sdp
Content-Length:   533

v=0
o=SERVER_VER 3859035080 3859035082 IN IP4 SIPSERVER_PRIVATE
s=SERVER_VER
c=IN IP4 SIPSERVER_PRIVATE
t=0 0
a=msid-semantic:WMS *
m=audio 17142 RTP/AVP 0 101
a=connection:new
a=setup:actpass
a=fingerprint:SHA-256 2D:EE:92:6B:DC:8A:F6:67:05:E3:A6:46:FB:82:XC:4C:64:E6:2B:07:FC:A0:68:3F:11:2B:54:C1:Z6:6D:A9:40
a=rtpmap:0 PCMU/8000
a=rtpmap:101 telephone-event/8000
a=fmtp:101 0-16
a=ptime:20
a=maxp


18:11:21.892702 IP OPENSIPS_PUBLIC.7060 > MICROSIP_PUBLIC.52567: UDP, length 1387
SIP/2.0 183 Session Progress
Via: SIP/2.0/UDP MICROSIP_PUBLIC:52567;rport=52567;received=MICROSIP_PUBLIC;branch=z9hG4bKPj46bffa23943941f1bd0a94775b01ed7d
Record-Route: <sip:OPENSIPS_PRIVATE;lr;r2=on;ftag=5ce39dca015745f7bf6847e790a8f7f2;did=574.c4e57d47>
Record-Route: <sip:OPENSIPS_PUBLIC:7060;lr;r2=on;ftag=5ce39dca015745f7bf6847e790a8f7f2;did=574.c4e57d47>
Call-ID: b6870e28eef04b3887ab0c8d715072a1
From: <sip:USER@MICROSIP_PUBLIC>;tag=5ce39dca015745f7bf6847e790a8f7f2
To: <sip:1XXXXX@DOMAIN.COM>;tag=3be4778d-637c-4c9a-88df-59c90c351d8f
CSeq: 6724 INVITE
Server: SERVER_VER
Allow: OPTIONS, REGISTER, SUBSCRIBE, NOTIFY, PUBLISH, INVITE, ACK, BYE, CANCEL, UPDATE, PRACK, MESSAGE, REFER
Contact: <sip:SIPSERVER_PRIVATE:7060>
P-Asserted-Identity: <sip:611XXXXX@DOMAIN.COM>
Remote-Party-ID: <sip:611XXXXX@DOMAIN.COM>;party=called;privacy=off;screen=no
Content-Type: application/sdp
Content-Length: 419

v=0
o=SERVER_VER 3859035080 3859035082 IN IP4 OPENSIPS_PUBLIC
s=SERVER_VER
c=IN IP4 OPENSIPS_PUBLIC
t=0 0
a=msid-semantic:WMS *
m=audio 36162 RTP/AVP 0 101
a=connection:new
a=maxptime:150
a=msid:555ca56f-ef72-47ac-b480-248394ad27ef 63b7a67a-ae82-47f3-81a4-f138eec1afa9
a=rtcp-fb:* transport-cc
a=rtpmap:0 PCMU/8000
a=rtpmap:101 telephone-event/8000
a=fmtp:101 0-16
a=sendrecv
a=rtcp:36163
a=ptime:20


18:11:22.294301 IP SIPSERVER_PRIVATE.7060 > OPENSIPS_PRIVATE.5060: SIP: SIP/2.0 200 OK
SIP/2.0 200 OK
Via: SIP/2.0/UDP OPENSIPS_PRIVATE:5060;rport=5060;received=OPENSIPS_PRIVATE;branch=z9hG4bK11fa.b18e7683.0
Via: SIP/2.0/UDP MICROSIP_PUBLIC:52567;rport=52567;received=MICROSIP_PUBLIC;branch=z9hG4bKPj46bffa23943941f1bd0a94775b01ed7d
Record-Route: <sip:OPENSIPS_PRIVATE;lr;r2=on;ftag=5ce39dca015745f7bf6847e790a8f7f2;did=574.c4e57d47>
Record-Route: <sip:OPENSIPS_PUBLIC:7060;lr;r2=on;ftag=5ce39dca015745f7bf6847e790a8f7f2;did=574.c4e57d47>
Call-ID: b6870e28eef04b3887ab0c8d715072a1
From: <sip:USER@MICROSIP_PUBLIC>;tag=5ce39dca015745f7bf6847e790a8f7f2
To: <sip:1XXXXX@DOMAIN.COM>;tag=3be4778d-637c-4c9a-88df-59c90c351d8f
CSeq: 6724 INVITE
Server: SERVER_VER
Allow: OPTIONS, REGISTER, SUBSCRIBE, NOTIFY, PUBLISH, INVITE, ACK, BYE, CANCEL, UPDATE, PRACK, MESSAGE, REFER
Contact: <sip:SIPSERVER_PRIVATE:7060>
Supported: 100rel, replaces, norefersub
P-Asserted-Identity: <sip:611XXXXX@DOMAIN.COM>
Remote-Party-ID: <sip:611XXXXX@DOMAIN.COM>;party=called;privacy=off;screen=no
Content-Type: application/sdp
Content-Length:   533

v=0
o=SERVER_VER 3859035080 3859035082 IN IP4 SIPSERVER_PRIVATE
s=SERVER_VER
c=IN IP4 SIPSERVER_PRIVATE
t=0 0
a=msid-semantic:WMS *
m=audio 17142 RTP/AVP 0 101
a=connection:new
a=setup:actpass
a=fingerprint:SHA-256 23:EE:9Z:6B:0C:8A:F6:67:05:EA:A6:46:FZ:82:EC:4C:64:E6:2B:07:FS:A0:68:3F:11:2B:54:C1:76:6Z:A9:4X
a=rtpmap:0 PCMU/8000
a=rtpmap:101 telephone-event/8000
a=fmtp:1


18:11:22.299378 IP OPENSIPS_PUBLIC.7060 > MICROSIP_PUBLIC.52567: UDP, length 1414
SIP/2.0 200 OK
Via: SIP/2.0/UDP MICROSIP_PUBLIC:52567;rport=52567;received=MICROSIP_PUBLIC;branch=z9hG4bKPj46bffa23943941f1bd0a94775b01ed7d
Record-Route: <sip:OPENSIPS_PRIVATE;lr;r2=on;ftag=5ce39dca015745f7bf6847e790a8f7f2;did=574.c4e57d47>
Record-Route: <sip:OPENSIPS_PUBLIC:7060;lr;r2=on;ftag=5ce39dca015745f7bf6847e790a8f7f2;did=574.c4e57d47>
Call-ID: b6870e28eef04b3887ab0c8d715072a1
From: <sip:USER@MICROSIP_PUBLIC>;tag=5ce39dca015745f7bf6847e790a8f7f2
To: <sip:1XXXXX@DOMAIN.COM>;tag=3be4778d-637c-4c9a-88df-59c90c351d8f
CSeq: 6724 INVITE
Server: SERVER_VER
Allow: OPTIONS, REGISTER, SUBSCRIBE, NOTIFY, PUBLISH, INVITE, ACK, BYE, CANCEL, UPDATE, PRACK, MESSAGE, REFER
Contact: <sip:SIPSERVER_PRIVATE:7060>
Supported: 100rel, replaces, norefersub
P-Asserted-Identity: <sip:611XXXXX@DOMAIN.COM>
Remote-Party-ID: <sip:611XXXXX@DOMAIN.COM>;party=called;privacy=off;screen=no
Content-Type: application/sdp
Content-Length: 419

v=0
o=SERVER_VER 3859035080 3859035082 IN IP4 OPENSIPS_PUBLIC
s=SERVER_VER
c=IN IP4 OPENSIPS_PUBLIC
t=0 0
a=msid-semantic:WMS *
m=audio 36162 RTP/AVP 0 101
a=connection:new
a=maxptime:150
a=msid:555ca56f-ef72-47ac-b480-248394ad27ef 63b7a67a-ae82-47f3-81a4-f138eec1afa9
a=rtcp-fb:* transport-cc
a=rtpmap:0 PCMU/8000
a=rtpmap:101 telephone-event/8000
a=fmtp:101 0-16
a=sendrecv
a=rtcp:36163
a=ptime:20

18:11:22.402574 IP MICROSIP_PUBLIC.52567 > OPENSIPS_PUBLIC.7060: UDP, length 587
ACK sip:SIPSERVER_PRIVATE:7060 SIP/2.0
Via: SIP/2.0/UDP MICROSIP_PUBLIC:52567;rport;branch=z9hG4bKPjabf5cad0f09f4c97883f2e1df500d285
Max-Forwards: 70
From: <sip:USER@MICROSIP_PUBLIC>;tag=5ce39dca015745f7bf6847e790a8f7f2
To: <sip:1XXXXX@DOMAIN.COM>;tag=3be4778d-637c-4c9a-88df-59c90c351d8f
Call-ID: b6870e28eef04b3887ab0c8d715072a1
CSeq: 6724 ACK
Route: <sip:OPENSIPS_PUBLIC:7060;lr;r2=on;ftag=5ce39dca015745f7bf6847e790a8f7f2;did=574.c4e57d47>
Route: <sip:OPENSIPS_PRIVATE;lr;r2=on;ftag=5ce39dca015745f7bf6847e790a8f7f2;did=574.c4e57d47>
Content-Length:  0


18:11:22.406528 IP OPENSIPS_PRIVATE.5060 > SIPSERVER_PRIVATE.7060: SIP: ACK sip:SIPSERVER_PRIVATE:7060 SIP/2.0
ACK sip:SIPSERVER_PRIVATE:7060 SIP/2.0
Via: SIP/2.0/UDP OPENSIPS_PRIVATE:5060;branch=z9hG4bK11fa.b18e7683.2
Via: SIP/2.0/UDP MICROSIP_PUBLIC:52567;received=MICROSIP_PUBLIC;rport=52567;branch=z9hG4bKPjabf5cad0f09f4c97883f2e1df500d285
Max-Forwards: 69
From: <sip:USER@MICROSIP_PUBLIC>;tag=5ce39dca015745f7bf6847e790a8f7f2
To: <sip:1XXXXX@DOMAIN.COM>;tag=3be4778d-637c-4c9a-88df-59c90c351d8f
Call-ID: b6870e28eef04b3887ab0c8d715072a1
CSeq: 6724 ACK
Content-Length:  0


18:11:29.597576 IP MICROSIP_PUBLIC.52567 > OPENSIPS_PUBLIC.7060: UDP, length 956
REFER sip:SIPSERVER_PRIVATE:7060 SIP/2.0
Via: SIP/2.0/UDP MICROSIP_PUBLIC:52567;rport;branch=z9hG4bKPj43ebdc5f1b02480d81d55e96815adfa9
Max-Forwards: 70
From: <sip:USER@MICROSIP_PUBLIC>;tag=5ce39dca015745f7bf6847e790a8f7f2
To: <sip:1XXXXX@DOMAIN.COM>;tag=3be4778d-637c-4c9a-88df-59c90c351d8f
Contact: <sip:USER@MICROSIP_PUBLIC:52567;ob>;+sip.ice
Call-ID: b6870e28eef04b3887ab0c8d715072a1
CSeq: 6725 REFER
Route: <sip:OPENSIPS_PUBLIC:7060;lr;r2=on;ftag=5ce39dca015745f7bf6847e790a8f7f2;did=574.c4e57d47>
Route: <sip:OPENSIPS_PRIVATE;lr;r2=on;ftag=5ce39dca015745f7bf6847e790a8f7f2;did=574.c4e57d47>
Event: refer
Expires: 600
Supported: replaces, 100rel, timer, norefersub
Accept: message/sipfrag;version=2.0
Allow-Events: presence, message-summary, refer
Refer-To: <sip:NEW_DID@DOMAIN.COM:7060>
Referred-By: <sip:USER@MICROSIP_PUBLIC:7060>
User-Agent: MicroSIP/3.20.7
Content-Length:  0


18:11:29.601284 IP OPENSIPS_PRIVATE.5060 > SIPSERVER_PRIVATE.7060: SIP: REFER sip:SIPSERVER_PRIVATE:7060 SIP/2.0
REFER sip:SIPSERVER_PRIVATE:7060 SIP/2.0
Via: SIP/2.0/UDP OPENSIPS_PRIVATE:5060;branch=z9hG4bK21fa.b477c403.0
Via: SIP/2.0/UDP MICROSIP_PUBLIC:52567;received=MICROSIP_PUBLIC;rport=52567;branch=z9hG4bKPj43ebdc5f1b02480d81d55e96815adfa9
Max-Forwards: 69
From: <sip:USER@MICROSIP_PUBLIC>;tag=5ce39dca015745f7bf6847e790a8f7f2
To: <sip:1XXXXX@DOMAIN.COM>;tag=3be4778d-637c-4c9a-88df-59c90c351d8f
Contact: <sip:USER@MICROSIP_PUBLIC:52567;ob>;+sip.ice
Call-ID: b6870e28eef04b3887ab0c8d715072a1
CSeq: 6725 REFER
Event: refer
Expires: 600
Supported: replaces, 100rel, timer, norefersub
Accept: message/sipfrag;version=2.0
Allow-Events: presence, message-summary, refer
Refer-To: <sip:NEW_DID@DOMAIN.COM:7060>
Referred-By: <sip:USER@MICROSIP_PUBLIC:7060>
User-Agent: MicroSIP/3.20.7
Content-Length:  0


18:11:29.602366 IP SIPSERVER_PRIVATE.7060 > OPENSIPS_PRIVATE.5060: SIP: SIP/2.0 202 Accepted
SIP/2.0 202 Accepted
Via: SIP/2.0/UDP OPENSIPS_PRIVATE:5060;rport=5060;received=OPENSIPS_PRIVATE;branch=z9hG4bK21fa.b477c403.0
Via: SIP/2.0/UDP MICROSIP_PUBLIC:52567;rport=52567;received=MICROSIP_PUBLIC;branch=z9hG4bKPj43ebdc5f1b02480d81d55e96815adfa9
Call-ID: b6870e28eef04b3887ab0c8d715072a1
From: <sip:USER@MICROSIP_PUBLIC>;tag=5ce39dca015745f7bf6847e790a8f7f2
To: <sip:1XXXXX@DOMAIN.COM>;tag=3be4778d-637c-4c9a-88df-59c90c351d8f
CSeq: 6725 REFER
Expires: 600
Contact: <sip:SIPSERVER_PRIVATE:7060>
Allow: OPTIONS, REGISTER, SUBSCRIBE, NOTIFY, PUBLISH, INVITE, ACK, BYE, CANCEL, UPDATE, PRACK, MESSAGE, REFER
Supported: 100rel, timer, replaces, norefersub
Server: SERVER_VER
Content-Length:  0


18:11:29.602792 IP OPENSIPS_PUBLIC.7060 > MICROSIP_PUBLIC.52567: UDP, length 624
SIP/2.0 202 Accepted
Via: SIP/2.0/UDP MICROSIP_PUBLIC:52567;rport=52567;received=MICROSIP_PUBLIC;branch=z9hG4bKPj43ebdc5f1b02480d81d55e96815adfa9
Call-ID: b6870e28eef04b3887ab0c8d715072a1
From: <sip:USER@MICROSIP_PUBLIC>;tag=5ce39dca015745f7bf6847e790a8f7f2
To: <sip:1XXXXX@DOMAIN.COM>;tag=3be4778d-637c-4c9a-88df-59c90c351d8f
CSeq: 6725 REFER
Expires: 600
Contact: <sip:SIPSERVER_PRIVATE:7060>
Allow: OPTIONS, REGISTER, SUBSCRIBE, NOTIFY, PUBLISH, INVITE, ACK, BYE, CANCEL, UPDATE, PRACK, MESSAGE, REFER
Supported: 100rel, timer, replaces, norefersub
Server: SERVER_VER
Content-Length:  0


18:11:32.683880 IP SIPSERVER_PRIVATE.7060 > OPENSIPS_PRIVATE.5060: SIP: NOTIFY sip:USER@MICROSIP_PUBLIC:52567;ob SIP/2.0
NOTIFY sip:USER@MICROSIP_PUBLIC:52567;ob SIP/2.0
Via: SIP/2.0/UDP SIPSERVER_PRIVATE:7060;rport;branch=z9hG4bKPjc6def0f3-5a40-4f6d-b098-a70bc74736bc
From: <sip:1XXXXX@DOMAIN.COM>;tag=3be4778d-637c-4c9a-88df-59c90c351d8f
To: <sip:USER@MICROSIP_PUBLIC>;tag=5ce39dca015745f7bf6847e790a8f7f2
Contact: <sip:SIPSERVER_PRIVATE:7060>
Call-ID: b6870e28eef04b3887ab0c8d715072a1
CSeq: 23563 NOTIFY
Route: <sip:OPENSIPS_PRIVATE;lr;r2=on;ftag=5ce39dca015745f7bf6847e790a8f7f2;did=574.c4e57d47>
Route: <sip:OPENSIPS_PUBLIC:7060;lr;r2=on;ftag=5ce39dca015745f7bf6847e790a8f7f2;did=574.c4e57d47>
Event: refer
Subscription-State: active;expires=596
Allow-Events: presence, dialog, message-summary, refer
Max-Forwards: 70
User-Agent: SERVER_VER
Content-Type: message/sipfrag;version=2.0
Content-Length:    20

SIP/2.0 100 Trying

18:11:32.683953 IP SIPSERVER_PRIVATE.7060 > OPENSIPS_PRIVATE.5060: SIP: NOTIFY sip:USER@MICROSIP_PUBLIC:52567;ob SIP/2.0
NOTIFY sip:USER@MICROSIP_PUBLIC:52567;ob SIP/2.0
Via: SIP/2.0/UDP SIPSERVER_PRIVATE:7060;rport;branch=z9hG4bKPjcb9e7d44-9f5a-4923-b765-1ffb7b33c96c
From: <sip:1XXXXX@DOMAIN.COM>;tag=3be4778d-637c-4c9a-88df-59c90c351d8f
To: <sip:USER@MICROSIP_PUBLIC>;tag=5ce39dca015745f7bf6847e790a8f7f2
Contact: <sip:SIPSERVER_PRIVATE:7060>
Call-ID: b6870e28eef04b3887ab0c8d715072a1
CSeq: 23564 NOTIFY
Route: <sip:OPENSIPS_PRIVATE;lr;r2=on;ftag=5ce39dca015745f7bf6847e790a8f7f2;did=574.c4e57d47>
Route: <sip:OPENSIPS_PUBLIC:7060;lr;r2=on;ftag=5ce39dca015745f7bf6847e790a8f7f2;did=574.c4e57d47>
Event: refer
Subscription-State: active;expires=596
Allow-Events: presence, dialog, message-summary, refer
Max-Forwards: 70
User-Agent: SERVER_VER
Content-Type: message/sipfrag;version=2.0
Content-Length:    21

SIP/2.0 180 Ringing

18:11:32.685282 IP OPENSIPS_PUBLIC.7060 > MICROSIP_PUBLIC.52567: UDP, length 938
NOTIFY sip:USER@MICROSIP_PUBLIC:52567;ob SIP/2.0
Via: SIP/2.0/UDP OPENSIPS_PUBLIC:7060;branch=z9hG4bK4fab.18975735.0
Via: SIP/2.0/UDP SIPSERVER_PRIVATE:7060;received=SIPSERVER_PRIVATE;rport=7060;branch=z9hG4bKPjcb9e7d44-9f5a-4923-b765-1ffb7b33c96c
From: <sip:1XXXXX@DOMAIN.COM>;tag=3be4778d-637c-4c9a-88df-59c90c351d8f
To: <sip:USER@MICROSIP_PUBLIC>;tag=5ce39dca015745f7bf6847e790a8f7f2
Contact: <sip:SIPSERVER_PRIVATE:7060>
Call-ID: b6870e28eef04b3887ab0c8d715072a1
CSeq: 23564 NOTIFY
Route: <sip:OPENSIPS_PRIVATE;lr;r2=on;ftag=5ce39dca015745f7bf6847e790a8f7f2;did=574.c4e57d47>
Route: <sip:OPENSIPS_PUBLIC:7060;lr;r2=on;ftag=5ce39dca015745f7bf6847e790a8f7f2;did=574.c4e57d47>
Event: refer
Subscription-State: active;expires=596
Allow-Events: presence, dialog, message-summary, refer
Max-Forwards: 69
User-Agent: SERVER_VER
Content-Type: message/sipfrag;version=2.0
Content-Length:    21

SIP/2.0 180 Ringing

18:11:32.685629 IP OPENSIPS_PUBLIC.7060 > MICROSIP_PUBLIC.52567: UDP, length 937
NOTIFY sip:USER@MICROSIP_PUBLIC:52567;ob SIP/2.0
Via: SIP/2.0/UDP OPENSIPS_PUBLIC:7060;branch=z9hG4bK7fab.00e7abf7.0
Via: SIP/2.0/UDP SIPSERVER_PRIVATE:7060;received=SIPSERVER_PRIVATE;rport=7060;branch=z9hG4bKPjc6def0f3-5a40-4f6d-b098-a70bc74736bc
From: <sip:1XXXXX@DOMAIN.COM>;tag=3be4778d-637c-4c9a-88df-59c90c351d8f
To: <sip:USER@MICROSIP_PUBLIC>;tag=5ce39dca015745f7bf6847e790a8f7f2
Contact: <sip:SIPSERVER_PRIVATE:7060>
Call-ID: b6870e28eef04b3887ab0c8d715072a1
CSeq: 23563 NOTIFY
Route: <sip:OPENSIPS_PRIVATE;lr;r2=on;ftag=5ce39dca015745f7bf6847e790a8f7f2;did=574.c4e57d47>
Route: <sip:OPENSIPS_PUBLIC:7060;lr;r2=on;ftag=5ce39dca015745f7bf6847e790a8f7f2;did=574.c4e57d47>
Event: refer
Subscription-State: active;expires=596
Allow-Events: presence, dialog, message-summary, refer
Max-Forwards: 69
User-Agent: SERVER_VER
Content-Type: message/sipfrag;version=2.0
Content-Length:    20

SIP/2.0 100 Trying

18:11:32.691534 IP MICROSIP_PUBLIC.52567 > OPENSIPS_PUBLIC.7060: UDP, length 687
SIP/2.0 200 OK
Via: SIP/2.0/UDP OPENSIPS_PUBLIC:7060;received=OPENSIPS_PUBLIC;branch=z9hG4bK4fab.18975735.0
Via: SIP/2.0/UDP SIPSERVER_PRIVATE:7060;rport=7060;received=SIPSERVER_PRIVATE;branch=z9hG4bKPjcb9e7d44-9f5a-4923-b765-1ffb7b33c96c
Call-ID: b6870e28eef04b3887ab0c8d715072a1
From: <sip:1XXXXX@DOMAIN.COM>;tag=3be4778d-637c-4c9a-88df-59c90c351d8f
To: <sip:USER@MICROSIP_PUBLIC>;tag=5ce39dca015745f7bf6847e790a8f7f2
CSeq: 23564 NOTIFY
Contact: <sip:USER@MICROSIP_PUBLIC:52567;ob>;+sip.ice
Allow: PRACK, INVITE, ACK, BYE, CANCEL, UPDATE, INFO, SUBSCRIBE, NOTIFY, REFER, MESSAGE, OPTIONS
Supported: replaces, 100rel, timer, norefersub
Content-Length:  0


18:11:32.691582 IP MICROSIP_PUBLIC.52567 > OPENSIPS_PUBLIC.7060: UDP, length 497
SIP/2.0 500 Invalid CSeq
Via: SIP/2.0/UDP OPENSIPS_PUBLIC:7060;received=OPENSIPS_PUBLIC;branch=z9hG4bK7fab.00e7abf7.0
Via: SIP/2.0/UDP SIPSERVER_PRIVATE:7060;rport=7060;received=SIPSERVER_PRIVATE;branch=z9hG4bKPjc6def0f3-5a40-4f6d-b098-a70bc74736bc
Call-ID: b6870e28eef04b3887ab0c8d715072a1
From: <sip:1XXXXX@DOMAIN.COM>;tag=3be4778d-637c-4c9a-88df-59c90c351d8f
To: <sip:USER@MICROSIP_PUBLIC>;tag=5ce39dca015745f7bf6847e790a8f7f2
CSeq: 23563 NOTIFY
Content-Length:  0


18:11:32.691974 IP OPENSIPS_PRIVATE.5060 > SIPSERVER_PRIVATE.7060: SIP: SIP/2.0 500 Invalid CSeq
SIP/2.0 500 Invalid CSeq
Via: SIP/2.0/UDP SIPSERVER_PRIVATE:7060;rport=7060;received=SIPSERVER_PRIVATE;branch=z9hG4bKPjc6def0f3-5a40-4f6d-b098-a70bc74736bc
Call-ID: b6870e28eef04b3887ab0c8d715072a1
From: <sip:1XXXXX@DOMAIN.COM>;tag=3be4778d-637c-4c9a-88df-59c90c351d8f
To: <sip:USER@MICROSIP_PUBLIC>;tag=5ce39dca015745f7bf6847e790a8f7f2
CSeq: 23563 NOTIFY
Content-Length:  0


18:11:32.692672 IP OPENSIPS_PRIVATE.5060 > SIPSERVER_PRIVATE.7060: SIP: SIP/2.0 200 OK
SIP/2.0 200 OK
Via: SIP/2.0/UDP SIPSERVER_PRIVATE:7060;rport=7060;received=SIPSERVER_PRIVATE;branch=z9hG4bKPjcb9e7d44-9f5a-4923-b765-1ffb7b33c96c
Call-ID: b6870e28eef04b3887ab0c8d715072a1
From: <sip:1XXXXX@DOMAIN.COM>;tag=3be4778d-637c-4c9a-88df-59c90c351d8f
To: <sip:USER@MICROSIP_PUBLIC>;tag=5ce39dca015745f7bf6847e790a8f7f2
CSeq: 23564 NOTIFY
Contact: <sip:USER@MICROSIP_PUBLIC:52567;ob>;+sip.ice
Allow: PRACK, INVITE, ACK, BYE, CANCEL, UPDATE, INFO, SUBSCRIBE, NOTIFY, REFER, MESSAGE, OPTIONS
Supported: replaces, 100rel, timer, norefersub
Content-Length:  0


18:11:42.092548 IP MICROSIP_PUBLIC.52567 > OPENSIPS_PUBLIC.7060: UDP, length 616
BYE sip:SIPSERVER_PRIVATE:7060 SIP/2.0
Via: SIP/2.0/UDP MICROSIP_PUBLIC:52567;rport;branch=z9hG4bKPj80ebce309808470f82d1cadb9a5ffc8d
Max-Forwards: 70
From: <sip:USER@MICROSIP_PUBLIC>;tag=5ce39dca015745f7bf6847e790a8f7f2
To: <sip:1XXXXX@DOMAIN.COM>;tag=3be4778d-637c-4c9a-88df-59c90c351d8f
Call-ID: b6870e28eef04b3887ab0c8d715072a1
CSeq: 6726 BYE
Route: <sip:OPENSIPS_PUBLIC:7060;lr;r2=on;ftag=5ce39dca015745f7bf6847e790a8f7f2;did=574.c4e57d47>
Route: <sip:OPENSIPS_PRIVATE;lr;r2=on;ftag=5ce39dca015745f7bf6847e790a8f7f2;did=574.c4e57d47>
User-Agent: MicroSIP/3.20.7
Content-Length:  0


18:11:42.099661 IP OPENSIPS_PRIVATE.5060 > SIPSERVER_PRIVATE.7060: SIP: BYE sip:SIPSERVER_PRIVATE:7060 SIP/2.0
BYE sip:SIPSERVER_PRIVATE:7060 SIP/2.0
Via: SIP/2.0/UDP OPENSIPS_PRIVATE:5060;branch=z9hG4bKf0fa.7133d505.0
Via: SIP/2.0/UDP MICROSIP_PUBLIC:52567;received=MICROSIP_PUBLIC;rport=52567;branch=z9hG4bKPj80ebce309808470f82d1cadb9a5ffc8d
Max-Forwards: 69
From: <sip:USER@MICROSIP_PUBLIC>;tag=5ce39dca015745f7bf6847e790a8f7f2
To: <sip:1XXXXX@DOMAIN.COM>;tag=3be4778d-637c-4c9a-88df-59c90c351d8f
Call-ID: b6870e28eef04b3887ab0c8d715072a1
CSeq: 6726 BYE
User-Agent: MicroSIP/3.20.7
Content-Length:  0


18:11:42.103986 IP SIPSERVER_PRIVATE.7060 > OPENSIPS_PRIVATE.5060: SIP: SIP/2.0 200 OK
SIP/2.0 200 OK
Via: SIP/2.0/UDP OPENSIPS_PRIVATE:5060;rport=5060;received=OPENSIPS_PRIVATE;branch=z9hG4bKf0fa.7133d505.0
Via: SIP/2.0/UDP MICROSIP_PUBLIC:52567;rport=52567;received=MICROSIP_PUBLIC;branch=z9hG4bKPj80ebce309808470f82d1cadb9a5ffc8d
Call-ID: b6870e28eef04b3887ab0c8d715072a1
From: <sip:USER@MICROSIP_PUBLIC>;tag=5ce39dca015745f7bf6847e790a8f7f2
To: <sip:1XXXXX@DOMAIN.COM>;tag=3be4778d-637c-4c9a-88df-59c90c351d8f
CSeq: 6726 BYE
Server: SERVER_VER
Content-Length:  0


18:11:42.104704 IP OPENSIPS_PUBLIC.7060 > MICROSIP_PUBLIC.52567: UDP, length 410
SIP/2.0 200 OK
Via: SIP/2.0/UDP MICROSIP_PUBLIC:52567;rport=52567;received=MICROSIP_PUBLIC;branch=z9hG4bKPj80ebce309808470f82d1cadb9a5ffc8d
Call-ID: b6870e28eef04b3887ab0c8d715072a1
From: <sip:USER@MICROSIP_PUBLIC>;tag=5ce39dca015745f7bf6847e790a8f7f2
To: <sip:1XXXXX@DOMAIN.COM>;tag=3be4778d-637c-4c9a-88df-59c90c351d8f
CSeq: 6726 BYE
Server: SERVER_VER
Content-Length:  0
```

**OS/environment information**
 - Operating System: Ubuntu 20.04.4 LTS
 - OpenSIPS installation: Compiled from source

**Additional information**
- When setting 'udp_workers' parameter to number of available CPUs the issue becomes much more rare but still persists. If I set 'udp_workers' to anything higher than available number of CPUs - the issue is persistent.

**Comment by Lt-Flash** [comment]
Also, in my OpenSIPS configuration I'm using mid_registrar module to save all contacts and then in initial route I had to use following syntax in order to process NOTIFY packets coming from SIP server, for some reason 'loose_route' wasn't routing them correctly:

```
        if (has_totag())
        {
            if (is_method("NOTIFY"))
            {
                    if (!mid_registrar_lookup("location","r"))
                    {
                        xlog("L_WARN","[NOTIFY]\t[$fU->$tU] No such SIP device found in lookup table: $tu, rejecting with 404 Not Found ($(ci{s.md5}))");
                        t_reply(404, "Not Found");
                        exit;
                    }
                    else
                    {
                        if ($du!=NULL)
                            xlog("L_WARN","[NOTIFY]\t[$fU->$tU] SIP device found at DU: $du, relaying ($(ci{s.md5}))");
                        else
                            xlog("L_WARN","[NOTIFY]\t[$fU->$tU] SIP device found at RU: $ru, relaying ($(ci{s.md5}))");
                        route(relay);
                        exit;
                    }
                    xlog("L_WARN","[NOTIFY]\tRouting NOTIFY packet addressed to someone else\r\n$mb\r\n");
            }

            if (loose_route())
            {
(here goes normal sequental packets processing)
```

**Comment by Lt-Flash** [comment]
I'm still waiting for some response from OpenSIPS team, the issue is still persistent.

**Comment by bogdan-iancu** [comment]
OpenSIPS does parallel handling of the SIP traffic, so the order (at IN versus OUT) of the packages may change. But SIP protocol does not rely on this. What microsip does (sending 2 requests in a row) it is wrong - the RFC3216 says that a SIP UAC must wait to receive the final reply for the current request, before being allowed to send a new request (in the same dialog, of course). IMO, it looks like a bug in microsip.

**Comment by Lt-Flash** [comment]
Hi Bogdan,
Thanks for your reply, that wasn't Microsio sending two packets, that was Asterisk, MicroSIP was replying to them and when CSeq was out of order it was replying with Invalid CSeq. Would that still be a bug on MicroSIP side?

**Comment by Lt-Flash** [comment]
Sorry, Bogdan, I was away. So, is it normal for OpenSIPS to send packets out of CSeq order? What's expected on remote side in that case? To just assemble and reorder them in correct order? Because to me MicroSIP's behaviour is correct - it's seeing SIP packets arriving with incorrect order of CSeq, so it drops first one and responds with '500 Invalid CSeq' as it wasn't expecting the number passed and then accepts second packet as it matches CSeq expected. Thanks!
