### ISSUE TITLE
[BUG] async rest call uses connect timeout rather than curl timeout

### ISSUE THREAD

**Issue by rrevels-bw** [OpenSIPS/opensips#3592]
**OpenSIPS version you are running**

```
version: opensips 3.4.11 (x86_64/linux)
flags: STATS: On, DISABLE_NAGLE, USE_MCAST, SHM_MMAP, PKG_MALLOC, Q_MALLOC, F_MALLOC, HP_MALLOC, DBG_MALLOC, FAST_LOCK-ADAPTIVE_WAIT
ADAPTIVE_WAIT_LOOPS=1024, MAX_RECV_BUFFER_SIZE 262144, MAX_LISTEN 16, MAX_URI_SIZE 1024, BUF_SIZE 65535
poll method support: poll, epoll, sigio_rt, select.
git revision: 56c9b5a
main.c compiled on  with gcc 12

```

**Describe the bug**

It appears to me that the smaller of async timeout or connect timeout is being used for libcurl for timeout in start_async_http_req() function and this is a problem if the connect timeout is set for 1 second and the curl timeout is set for 20 seconds and its taking 15 seconds to get a response from the web server.  

This problem only manifests itself on the second POST to an existing connection to the web server as the first one gets the connection in the small timeout and uses the larger timeout in the async callbacks as desired.

I came across this while i was modifying the code to allow the connect timeout to be set to in ms rather than seconds (hence the 51ms timeout for the first FIN/ACK in the trace at packet 48)

```
   44 9.111770324 192.168.100.107 ? 192.168.102.195 SIP/SDP 775 Request: INVITE sip:+18436700000@192.168.102.195:5060 | 
   45 0.005231056 192.168.102.195 ? 192.168.100.107 SIP 353 Status: 100 Giving it a try | 
   46 0.000148469 192.168.102.195 ? 192.168.100.114 HTTP/JSON 953 POST /apachemock.php HTTP/1.1 , JavaScript Object Notation (application/json)
   47 0.000337180 192.168.100.114 ? 192.168.102.195 TCP 66 8086 ? 40062 [ACK] Seq=1264 Ack=1775 Win=32512 Len=0 TSval=4189848034 TSecr=1836173647
   48 0.051905107 192.168.102.195 ? 192.168.100.114 TCP 66 40062 ? 8086 [FIN, ACK] Seq=1775 Ack=1264 Win=64128 Len=0 TSval=1836173700 TSecr=4189848034
   49 0.000353519 192.168.102.195 ? 192.168.100.114 TCP 74 57814 ? 8086 [SYN] Seq=0 Win=64240 Len=0 MSS=1460 SACK_PERM TSval=1836173700 TSecr=0 WS=128
   50 0.000263665 192.168.100.114 ? 192.168.102.195 TCP 74 8086 ? 57814 [SYN, ACK] Seq=0 Ack=1 Win=28960 Len=0 MSS=1460 SACK_PERM TSval=4189848087 TSecr=1836173700 WS=128
   51 0.000045769 192.168.102.195 ? 192.168.100.114 TCP 66 57814 ? 8086 [ACK] Seq=1 Ack=1 Win=64256 Len=0 TSval=1836173700 TSecr=4189848087
   52 0.001899525 192.168.102.195 ? 192.168.100.114 HTTP/JSON 953 POST /apachemock.php HTTP/1.1 , JavaScript Object Notation (application/json)
   53 0.000174557 192.168.100.114 ? 192.168.102.195 TCP 66 8086 ? 57814 [ACK] Seq=1 Ack=888 Win=30848 Len=0 TSval=4189848089 TSecr=1836173702
   54 0.036595540 192.168.100.114 ? 192.168.102.195 TCP 66 8086 ? 40062 [ACK] Seq=1264 Ack=1776 Win=32512 Len=0 TSval=4189848126 TSecr=1836173700
```

**To Reproduce**

1. start opensips with single listen thread (to help get the same curl connection)
2. set connect timeout to some value
3. set curl timeout to some much larger value
4. send INVITE to get connection to web server established using async rest_post
5. allow transaction to finish
6. send 2nd INVITE and observe that FIN/ACK is sent after webserver ACK to second POST in connect timeout rather than waiting for response in a async callback.

**Expected behavior**
I expect the 2nd http request to be handled without closing the open connection and a new one created.

**Relevant System Logs**

**OS/environment information**
 - Operating System: 
 - OpenSIPS installation: 
 - other relevant information:

**Additional context**

**Comment by rrevels-bw** [comment]
Actually, this looks a little different than I was expecting it to.   It's looping in the curl_multi_perform block, perhaps waiting for the connect flag (havent gotten that far yet) despite the POST having been sent and ACK returned and then failing back to the application which then does another async rest_post which creates a new connection and succeeds just fine.

```
2025-03-01T05:21:54.165736+0000 sbc-proxy-03.lab1.core.sip.bwnet.us /usr/local/opensips/sbin/opensips[973674]: ERROR:rest_client:start_async_http_req: ongoing transfer on fd 130
2025-03-01T05:21:54.167844+0000 sbc-proxy-03.lab1.core.sip.bwnet.us /usr/local/opensips/sbin/opensips[973674]: ERROR:rest_client:start_async_http_req: ongoing transfer on fd 130
2025-03-01T05:21:54.169958+0000 sbc-proxy-03.lab1.core.sip.bwnet.us /usr/local/opensips/sbin/opensips[973674]: ERROR:rest_client:start_async_http_req: ongoing transfer on fd 130
2025-03-01T05:21:54.172040+0000 sbc-proxy-03.lab1.core.sip.bwnet.us /usr/local/opensips/sbin/opensips[973674]: ERROR:rest_client:start_async_http_req: ongoing transfer on fd 130
2025-03-01T05:21:54.174148+0000 sbc-proxy-03.lab1.core.sip.bwnet.us /usr/local/opensips/sbin/opensips[973674]: ERROR:rest_client:start_async_http_req: ongoing transfer on fd 130
2025-03-01T05:21:54.176294+0000 sbc-proxy-03.lab1.core.sip.bwnet.us /usr/local/opensips/sbin/opensips[973674]: ERROR:rest_client:start_async_http_req: ongoing transfer on fd 130
2025-03-01T05:21:54.178411+0000 sbc-proxy-03.lab1.core.sip.bwnet.us /usr/local/opensips/sbin/opensips[973674]: ERROR:rest_client:start_async_http_req: ongoing transfer on fd 130
2025-03-01T05:21:54.180537+0000 sbc-proxy-03.lab1.core.sip.bwnet.us /usr/local/opensips/sbin/opensips[973674]: ERROR:rest_client:start_async_http_req: ongoing transfer on fd 130
2025-03-01T05:21:54.182630+0000 sbc-proxy-03.lab1.core.sip.bwnet.us /usr/local/opensips/sbin/opensips[973674]: ERROR:rest_client:start_async_http_req: ongoing transfer on fd 130
2025-03-01T05:21:54.184713+0000 sbc-proxy-03.lab1.core.sip.bwnet.us /usr/local/opensips/sbin/opensips[973674]: ERROR:rest_client:start_async_http_req: ongoing transfer on fd 130
2025-03-01T05:21:54.186801+0000 sbc-proxy-03.lab1.core.sip.bwnet.us /usr/local/opensips/sbin/opensips[973674]: ERROR:rest_client:start_async_http_req: ongoing transfer on fd 130
2025-03-01T05:21:54.188921+0000 sbc-proxy-03.lab1.core.sip.bwnet.us /usr/local/opensips/sbin/opensips[973674]: ERROR:rest_client:start_async_http_req: ongoing transfer on fd 130
2025-03-01T05:21:54.191038+0000 sbc-proxy-03.lab1.core.sip.bwnet.us /usr/local/opensips/sbin/opensips[973674]: ERROR:rest_client:start_async_http_req: ongoing transfer on fd 130
2025-03-01T05:21:54.193129+0000 sbc-proxy-03.lab1.core.sip.bwnet.us /usr/local/opensips/sbin/opensips[973674]: ERROR:rest_client:start_async_http_req: ongoing transfer on fd 130
2025-03-01T05:21:54.195214+0000 sbc-proxy-03.lab1.core.sip.bwnet.us /usr/local/opensips/sbin/opensips[973674]: ERROR:rest_client:start_async_http_req: ongoing transfer on fd 130
2025-03-01T05:21:54.197299+0000 sbc-proxy-03.lab1.core.sip.bwnet.us /usr/local/opensips/sbin/opensips[973674]: ERROR:rest_client:start_async_http_req: ongoing transfer on fd 130
2025-03-01T05:21:54.199406+0000 sbc-proxy-03.lab1.core.sip.bwnet.us /usr/local/opensips/sbin/opensips[973674]: ERROR:rest_client:start_async_http_req: ongoing transfer on fd 130
2025-03-01T05:21:54.201498+0000 sbc-proxy-03.lab1.core.sip.bwnet.us /usr/local/opensips/sbin/opensips[973674]: ERROR:rest_client:start_async_http_req: ongoing transfer on fd 130
2025-03-01T05:21:54.203584+0000 sbc-proxy-03.lab1.core.sip.bwnet.us /usr/local/opensips/sbin/opensips[973674]: ERROR:rest_client:start_async_http_req: ongoing transfer on fd 130
2025-03-01T05:21:54.205712+0000 sbc-proxy-03.lab1.core.sip.bwnet.us /usr/local/opensips/sbin/opensips[973674]: ERROR:rest_client:start_async_http_req: ongoing transfer on fd 130
2025-03-01T05:21:54.207808+0000 sbc-proxy-03.lab1.core.sip.bwnet.us /usr/local/opensips/sbin/opensips[973674]: ERROR:rest_client:start_async_http_req: ongoing transfer on fd 130
2025-03-01T05:21:54.209900+0000 sbc-proxy-03.lab1.core.sip.bwnet.us /usr/local/opensips/sbin/opensips[973674]: ERROR:rest_client:start_async_http_req: ongoing transfer on fd 130
2025-03-01T05:21:54.212000+0000 sbc-proxy-03.lab1.core.sip.bwnet.us /usr/local/opensips/sbin/opensips[973674]: ERROR:rest_client:start_async_http_req: ongoing transfer on fd 130
2025-03-01T05:21:54.214084+0000 sbc-proxy-03.lab1.core.sip.bwnet.us /usr/local/opensips/sbin/opensips[973674]: ERROR:rest_client:start_async_http_req: ongoing transfer on fd 130
2025-03-01T05:21:54.216178+0000 sbc-proxy-03.lab1.core.sip.bwnet.us /usr/local/opensips/sbin/opensips[973674]: ERROR:rest_client:start_async_http_req: ongoing transfer on fd 130
2025-03-01T05:21:54.220811+0000 sbc-proxy-03.lab1.core.sip.bwnet.us /usr/local/opensips/sbin/opensips[973674]: ERROR:rest_client:start_async_http_req: ongoing transfer on fd 130
2025-03-01T05:21:54.220826+0000 sbc-proxy-03.lab1.core.sip.bwnet.us /usr/local/opensips/sbin/opensips[973674]: ERROR:rest_client:start_async_http_req: >>> add fd 130 to ongoing transfers
```

```
    1 2025-03-01 05:21:54.165697176 192.168.102.195 ? 192.168.100.114 HTTP/JSON 953 POST /apachemock.php HTTP/1.1 , JavaScript Object Notation (application/json)
    2 2025-03-01 05:21:54.166006807 192.168.100.114 ? 192.168.102.195 TCP 66 8086 ? 53350 [ACK] Seq=1 Ack=888 Win=254 Len=0 TSval=4218088086 TSecr=1864413699
    3 2025-03-01 05:21:54.218290424 192.168.102.195 ? 192.168.100.114 TCP 66 53350 ? 8086 [FIN, ACK] Seq=888 Ack=1 Win=501 Len=0 TSval=1864413751 TSecr=4218088086
    4 2025-03-01 05:21:54.218585322 192.168.102.195 ? 192.168.100.114 TCP 74 54658 ? 8086 [SYN] Seq=0 Win=64240 Len=0 MSS=1460 SACK_PERM TSval=1864413751 TSecr=0 WS=128
    5 2025-03-01 05:21:54.218794125 192.168.100.114 ? 192.168.102.195 TCP 74 8086 ? 54658 [SYN, ACK] Seq=0 Ack=1 Win=28960 Len=0 MSS=1460 SACK_PERM TSval=4218088139 TSecr=1864413751 WS=128
    6 2025-03-01 05:21:54.218833306 192.168.102.195 ? 192.168.100.114 TCP 66 54658 ? 8086 [ACK] Seq=1 Ack=1 Win=64256 Len=0 TSval=1864413752 TSecr=4218088139
    7 2025-03-01 05:21:54.220775365 192.168.102.195 ? 192.168.100.114 HTTP/JSON 953 POST /apachemock.php HTTP/1.1 , JavaScript Object Notation (application/json)
    8 2025-03-01 05:21:54.220963845 192.168.100.114 ? 192.168.102.195 TCP 66 8086 ? 54658 [ACK] Seq=1 Ack=888 Win=30848 Len=0 TSval=4218088141 TSecr=1864413754
    9 2025-03-01 05:21:54.258437142 192.168.100.114 ? 192.168.102.195 TCP 66 8086 ? 53350 [ACK] Seq=1 Ack=889 Win=254 Len=0 TSval=4218088179 TSecr=1864413751
 
```

**Comment by rrevels-bw** [comment]
this change solves the problem for me (in rest_methods.c) but the curl timer i was hoping would tell me how long a connection has been established does not.   so, i hope to do a bit better next week.

```
-                                       LM_DBG("ongoing transfer on fd %d\n", fd);
+                                       LM_DBG("ongoing transfer on fd %d with connect: %.3lfs and reqsz: %ldB "
+                                                  "and running handles: %d and pretransfer %.3lfs \n",
+                                                  fd, connect, req_sz, running_handles, pretransfer);
                                        if (connect > 0 && req_sz > 0 && is_new_transfer(fd)) {
                                                LM_DBG(">>> add fd %d to ongoing transfers\n", fd);
                                                add_transfer(fd);
                                                goto success;
+                                       } else if ( req_sz > 0 && is_new_transfer(fd)) {
+                                               LM_DBG(">>> fd %d in ongoing transfers - send to async\n", fd);
+                                               add_transfer(fd);
+                                               goto success;
```

**Comment by rrevels-bw** [comment]
actually, it looks like just taking the connect time check out and looking for request size is enough but this is only based on my use case.  there could be others im not taking into account so the check for CURLINFO_PRETRANSFER_TIME_T also seems to be an indication the connect was established regardless of whether it happened on this request or a previous one.

**Comment by rrevels-bw** [comment]
ping to remove stale

**Comment by bogdan-iancu** [comment]
@rrevels-bw , have you generated a pull request with the patch here ?

**Comment by rrevels-bw** [comment]
Not yet.   I have it on my things to do and will get it this month.  In
addition to the change to the connect loop I modified the module params so
the connect timeout can be set in milliseconds (while being backward
compatible with the seconds timeout) .   I was hoping to also be able to do
the same for the transfer timeout but that would require the async timeout
to be able to be defined in milliseconds.  I could not find a way around it
using the lib-curl callbacks so have to back all that out of my changes.
 In the end, I can survive with a full second timeout even at a pretty high
call rate so am happy with what i ended up with.


Richard Revels
