### ISSUE TITLE
[BUG] SMPP  trunk

### ISSUE THREAD

**Issue by volga629** [OpenSIPS/opensips#1728]
**OpenSIPS version you are running**

```
opensips -V
version: opensips 3.0.0 (x86_64/linux)
flags: STATS: On, DISABLE_NAGLE, USE_MCAST, SHM_MMAP, PKG_MALLOC, Q_MALLOC, F_MALLOC, HP_MALLOC, DBG_MALLOC, FAST_LOCK-ADAPTIVE_WAIT
ADAPTIVE_WAIT_LOOPS=1024, MAX_RECV_BUFFER_SIZE 262144, MAX_LISTEN 16, MAX_URI_SIZE 1024, BUF_SIZE 65535
poll method support: poll, epoll, sigio_rt, select.
main.c compiled on 13:21:56 May 29 2019 with gcc 8

```

**Describe the bug**

SMPP trunk setup with VoIP provider .
SMPP trunk initialized, but then get disconnected and opensips produce error in log 

```
Jun 10 04:35:39 smsc /usr/sbin/opensips[29432]: ERROR:proto_smpp:smpp_send_msg: cannot fetch connection for SMS_C (0)
Jun 10 04:35:44 smsc /usr/sbin/opensips[29434]: ERROR:proto_smpp:smpp_send_msg: cannot fetch connection for SMS_C (0)
``` 
Based on information from provider opensips send incorrect information.

```
2019-06-07 14:30:53.959 [22670] [21] ERROR: SMPP: PDU length was too small (-797211610, minimum is 16). 
2019-06-07 14:30:53.959 [22670] [21] ERROR: ESME[username] Client sent garbage, closing connection from IP `207.35.127.183:49169'. 
2019-06-07 14:38:47.377 [23345] [25] ERROR: SMPP: PDU length was too large (1229866575, maximum is 7424). 
2019-06-07 14:38:47.377 [23345] [25] ERROR: ESME[username] Client sent garbage, closing connection from IP `207.35.127.183:53645'.
```

SMPP Trunk Flow

![991289](https://user-images.githubusercontent.com/3235221/59196586-74db5600-8b65-11e9-92ad-268205fe8b4d.png)

Opensips log says about unsupported format 

```

Jun  7 10:02:34 smsc /usr/sbin/opensips[10821]: WARNING:proto_smpp:handle_smpp_msg: Unknown or unsupported command received 00000006
Jun  7 10:02:38 smsc /usr/sbin/opensips[10827]: ERROR:proto_smpp:smpp_send_msg: cannot fetch connection for SMS_C (0)
Jun  7 10:02:43 smsc /usr/sbin/opensips[10823]: ERROR:proto_smpp:smpp_send_msg: cannot fetch connection for SMS_C (0)
Jun  7 10:02:48 smsc /usr/sbin/opensips[10829]: ERROR:proto_smpp:smpp_send_msg: cannot fetch connection for SMS_C (0)
Jun  7 10:02:53 smsc /usr/sbin/opensips[10829]: ERROR:proto_smpp:smpp_send_msg: cannot fetch connection for SMS_C (0)

```

**To Reproduce**

Example:
1. Install Opensips SMPP module
2. Provision Database smpp table with provider information 
3.  Start opensips
4.  Watch opensips log produce errors. 

**Expected behavior**

Expect stable state for SMPP trunk where messages can flow without interruption bidirectional.

**Relevant System Logs**

**OS/environment information**

```
 cat /etc/redhat-release 
Fedora release 29 (Twenty Nine)
[root@smsc ~]# rpm -qa | grep opensips
opensips-proto_smpp-3.0.0-1.fc29.x86_64
opensips-proto_smpp-debuginfo-3.0.0-1.fc29.x86_64
opensips-debuginfo-3.0.0-1.fc29.x86_64
opensips-3.0.0-1.fc29.x86_64
opensips-httpd-3.0.0-1.fc29.x86_64
opensips-debugsource-3.0.0-1.fc29.x86_64
opensips-db_mysql-3.0.0-1.fc29.x86_64
python-opensips-cli-1.0.0.f1717ac-4.fc29.x86_64
```

**Additional context**

**Comment by volga629** [comment]
Also I provided pcap with time frame from opensips  start.

**Comment by volga629** [comment]
Here some additional  information from provider.

```
All we can tell you is, after we send deliver_sm, you should not
        send the generic_nack. But deliver_sm_resp.
```

**Comment by volga629** [comment]
Hello Everyone,
I know you all busy, but possible give priority to this ticket. It start affecting pretty  hard .

**Comment by volga629** [comment]
Hello Everyone, 
Is possible get update on this issue, tomorrow is 15 days ???

**Comment by razvancrainea** [comment]
I am sorry, I did receive your PCAPs, but I simply couldn't find the time to check them out. As soon as I do, I will get back to you.

**Comment by volga629** [comment]
Thank you for reply.

**Comment by volga629** [comment]
Opensips don't have debug  for smpp I couldn't find what was event ID 6, so I tried debug with freeswitch and get the following information regard ID 6


```
2019-06-30 07:05:48.471881 [INFO] mod_smpp_utils.c:41 PDU 
command_length                [00000010] - [16]
command_id                    [00000006] - [UNBIND]
command_status                [00000000] - [ESME_ROK]
sequence_number               [5CFAB1E3] - [1559933411]

2019-06-30 07:05:48.471881 [ERR] mod_smpp_gateway.c:297 Unrecognized Command ID: 6
2019-06-30 07:05:48.471881 [ERR] mod_smpp_gateway.c:359 Unknown command_id[6]
2019-06-30 07:05:50.471884 [ERR] mod_smpp_gateway.c:224 Failed to recv on the socket

```

**Comment by volga629** [comment]
Here are list of events for smpp events.

```
exports.command_ids = {                              // Use command_ids to look up by ID
    0x80000000: 'generic_nack',
    0x00000001: 'bind_receiver',
    0x80000001: 'bind_receiver_resp',
    0x00000002: 'bind_transmitter',
    0x80000002: 'bind_transmitter_resp',
    0x00000003: 'query_sm',
    0x80000003: 'query_sm_resp',
    0x00000004: 'submit_sm',
    0x80000004: 'submit_sm_resp',
    0x00000005: 'deliver_sm',
    0x80000005: 'deliver_sm_resp',
    0x00000006: 'unbind',
    0x80000006: 'unbind_resp',
    0x00000007: 'replace_sm',
    0x80000007: 'replace_sm_resp',
    0x00000008: 'cancel_sm',
    0x80000008: 'cancel_sm_resp',
    0x00000009: 'bind_transceiver',
    0x80000009: 'bind_transceiver_resp',
    0x0000000B: 'outbind',
    0x00000015: 'enquire_link',
    0x80000015: 'enquire_link_resp',
    0x00000021: 'submit_multi',
    0x80000021: 'submit_multi_resp',
    0x00000102: 'alert_notification',
    0x00000103: 'data_sm',
    0x80000103: 'data_sm_resp'
};
```

**Comment by volga629** [comment]
Razvan,
Can you please let me know when you can take a look on issue. It start affecting production deployment timelines. Thank you.

**Comment by razvancrainea** [comment]
I've just pushed a fix for this - could you please take the latest sources and test again?

**Comment by volga629** [comment]
Hello Razvan,
Thank you, going test right now.

**Comment by volga629** [comment]
> All we can tell you is, after we send deliver_sm, you should not
>         send the generic_nack. But deliver_sm_resp.

Razvan,
What  you think about this ?

volga629

**Comment by razvancrainea** [comment]
I doubt we are sending `generic_nack`, but even if we do, we must be sending it because an error occurred - we should investigate that error. But that's not a general handling, in most of the cases, and the pcaps you have sent confirm this, we are sending `deliver_sm_resp`.

**Comment by volga629** [comment]
ok let me test all first fixes first. Thank yo for answer.

**Comment by volga629** [comment]
Hello Razvan,
Here Log test results 
It still stop connection after first inbound SMS

```
Jul  5 06:03:34 smsc /usr/sbin/opensips[15608]: Sending sms from source ip ~> [207.35.127.188]
Jul  5 06:03:34 smsc /usr/sbin/opensips[15608]: ERROR:proto_smpp:smpp_send_msg: cannot fetch connection for SMS_C (0)
Jul  5 06:03:34 smsc /usr/sbin/opensips[15608]: SMPP trunk return ~> -1
Jul  5 06:03:34 smsc /usr/sbin/opensips[15608]: SMPP trunk return error
Jul  5 06:03:36 smsc /usr/sbin/opensips[15612]: ERROR:proto_smpp:smpp_send_msg: cannot fetch connection for SMS_C (0)
Jul  5 06:03:40 smsc /usr/sbin/opensips[15607]: ERROR:proto_smpp:smpp_send_msg: cannot fetch connection for SMS_C (0)
Jul  5 06:03:45 smsc /usr/sbin/opensips[15619]: ERROR:proto_smpp:smpp_send_msg: cannot fetch connection for SMS_C (0)
Jul  5 06:01:56 smsc /usr/sbin/opensips[15609]: INFO:core:init_sock_keepalive: TCP keepalive enabled on socket 100
Jul  5 06:01:56 smsc /usr/sbin/opensips[15609]: INFO:proto_smpp:smpp_conn_init: smpp_conn_init called
Jul  5 06:01:56 smsc /usr/sbin/opensips[15611]: ERROR:proto_smpp:handle_bind_transceiver_resp_cmd: Error in bind_transceiver_resp 0000000d
```

**Comment by volga629** [comment]
I sent you fresh pcap

**Comment by razvancrainea** [comment]
Indeed, my previous commit was not complete. Could you please try the new version?

**Comment by volga629** [comment]
Hello Razvan,
Having some issue with compile right now
Trying new patch

```
/home/volga629/rpmbuild/BUILD/opensips-3.0.0/modules/proto_smpp/smpp.csmpp.c:115: multiple definition of `get_payload_from_submit_sm_body'; smpp.o:/home/volga629/rpmbuild/BUILD/opensips-3.0.0/modules/proto_smpp/smpp.c:115: first defined here
/usr/bin/ld: smpp.csmpp.o: in function `get_payload_from_deliver_sm_resp_body':
/home/volga629/rpmbuild/BUILD/opensips-3.0.0/modules/proto_smpp/smpp.csmpp.c:145: multiple definition of `get_payload_from_deliver_sm_resp_body'; smpp.o:/home/volga629/rpmbuild/BUILD/opensips-3.0.0/modules/proto_smpp/smpp.c:145: first defined here
/usr/bin/ld: smpp.csmpp.o: in function `get_payload_from_submit_sm_resp_body':
/home/volga629/rpmbuild/BUILD/opensips-3.0.0/modules/proto_smpp/smpp.csmpp.c:156: multiple definition of `get_payload_from_submit_sm_resp_body'; smpp.o:/home/volga629/rpmbuild/BUILD/opensips-3.0.0/modules/proto_smpp/smpp.c:156: first defined here
/usr/bin/ld: smpp.csmpp.o: in function `send_outbind':
/home/volga629/rpmbuild/BUILD/opensips-3.0.0/modules/proto_smpp/smpp.csmpp.c:488: multiple definition of `send_outbind'; smpp.o:/home/volga629/rpmbuild/BUILD/opensips-3.0.0/modules/proto_smpp/smpp.c:488: first defined here
/usr/bin/ld: smpp.csmpp.o: in function `bind_session':
/home/volga629/rpmbuild/BUILD/opensips-3.0.0/modules/proto_smpp/smpp.csmpp.c:576: multiple definition of `bind_session'; smpp.o:/home/volga629/rpmbuild/BUILD/opensips-3.0.0/modules/proto_smpp/smpp.c:576: first defined here
/usr/bin/ld: smpp.csmpp.o:/home/volga629/rpmbuild/BUILD/opensips-3.0.0/modules/proto_smpp/smpp.csmpp.c:49: multiple definition of `smpp_send_timeout'; smpp.o:/home/volga629/rpmbuild/BUILD/opensips-3.0.0/modules/proto_smpp/smpp.c:49: first defined here
/usr/bin/ld: smpp.csmpp.o: in function `smpp_bind_sessions':
/home/volga629/rpmbuild/BUILD/opensips-3.0.0/modules/proto_smpp/smpp.csmpp.c:591: multiple definition of `smpp_bind_sessions'; smpp.o:/home/volga629/rpmbuild/BUILD/opensips-3.0.0/modules/proto_smpp/smpp.c:591: first defined here
/usr/bin/ld: smpp.csmpp.o: in function `rpc_bind_sessions':
/home/volga629/rpmbuild/BUILD/opensips-3.0.0/modules/proto_smpp/smpp.csmpp.c:602: multiple definition of `rpc_bind_sessions'; smpp.o:/home/volga629/rpmbuild/BUILD/opensips-3.0.0/modules/proto_smpp/smpp.c:602: first defined here
/usr/bin/ld: smpp.csmpp.o: in function `enquire_link':
/home/volga629/rpmbuild/BUILD/opensips-3.0.0/modules/proto_smpp/smpp.csmpp.c:612: multiple definition of `enquire_link'; smpp.o:/home/volga629/rpmbuild/BUILD/opensips-3.0.0/modules/proto_smpp/smpp.c:612: first defined here
/usr/bin/ld: smpp.csmpp.o: in function `parse_bind_receiver_body':
/home/volga629/rpmbuild/BUILD/opensips-3.0.0/modules/proto_smpp/smpp.csmpp.c:668: multiple definition of `parse_bind_receiver_body'; smpp.o:/home/volga629/rpmbuild/BUILD/opensips-3.0.0/modules/proto_smpp/smpp.c:668: first defined here
/usr/bin/ld: smpp.csmpp.o: in function `parse_bind_receiver_resp_body':
/home/volga629/rpmbuild/BUILD/opensips-3.0.0/modules/proto_smpp/smpp.csmpp.c:685: multiple definition of `parse_bind_receiver_resp_body'; smpp.o:/home/volga629/rpmbuild/BUILD/opensips-3.0.0/modules/proto_smpp/smpp.c:685: first defined here
/usr/bin/ld: smpp.csmpp.o: in function `parse_bind_transmitter_body':
/home/volga629/rpmbuild/BUILD/opensips-3.0.0/modules/proto_smpp/smpp.csmpp.c:695: multiple definition of `parse_bind_transmitter_body'; smpp.o:/home/volga629/rpmbuild/BUILD/opensips-3.0.0/modules/proto_smpp/smpp.c:695: first defined here
/usr/bin/ld: smpp.csmpp.o: in function `parse_bind_transmitter_resp_body':
/home/volga629/rpmbuild/BUILD/opensips-3.0.0/modules/proto_smpp/smpp.csmpp.c:700: multiple definition of `parse_bind_transmitter_resp_body'; smpp.o:/home/volga629/rpmbuild/BUILD/opensips-3.0.0/modules/proto_smpp/smpp.c:700: first defined here
/usr/bin/ld: smpp.csmpp.o: in function `parse_bind_transceiver_body':
/home/volga629/rpmbuild/BUILD/opensips-3.0.0/modules/proto_smpp/smpp.csmpp.c:701: multiple definition of `parse_bind_transceiver_body'; smpp.o:/home/volga629/rpmbuild/BUILD/opensips-3.0.0/modules/proto_smpp/smpp.c:701: first defined here
/usr/bin/ld: smpp.csmpp.o: in function `parse_bind_transceiver_resp_body':
/home/volga629/rpmbuild/BUILD/opensips-3.0.0/modules/proto_smpp/smpp.csmpp.c:701: multiple definition of `parse_bind_transceiver_resp_body'; smpp.o:/home/volga629/rpmbuild/BUILD/opensips-3.0.0/modules/proto_smpp/smpp.c:701: first defined here
/usr/bin/ld: smpp.csmpp.o: in function `parse_submit_or_deliver_resp_body':
/home/volga629/rpmbuild/BUILD/opensips-3.0.0/modules/proto_smpp/smpp.csmpp.c:715: multiple definition of `parse_submit_or_deliver_resp_body'; smpp.o:/home/volga629/rpmbuild/BUILD/opensips-3.0.0/modules/proto_smpp/smpp.c:715: first defined here
/usr/bin/ld: smpp.csmpp.o: in function `send_submit_or_deliver_resp':
/home/volga629/rpmbuild/BUILD/opensips-3.0.0/modules/proto_smpp/smpp.csmpp.c:725: multiple definition of `send_submit_or_deliver_resp'; smpp.o:/home/volga629/rpmbuild/BUILD/opensips-3.0.0/modules/proto_smpp/smpp.c:725: first defined here
/usr/bin/ld: smpp.csmpp.o: in function `check_bind_session':
/home/volga629/rpmbuild/BUILD/opensips-3.0.0/modules/proto_smpp/smpp.csmpp.c:745: multiple definition of `check_bind_session'; smpp.o:/home/volga629/rpmbuild/BUILD/opensips-3.0.0/modules/proto_smpp/smpp.c:745: first defined here
/usr/bin/ld: smpp.csmpp.o: in function `send_bind_resp':
/home/volga629/rpmbuild/BUILD/opensips-3.0.0/modules/proto_smpp/smpp.csmpp.c:766: multiple definition of `send_bind_resp'; smpp.o:/home/volga629/rpmbuild/BUILD/opensips-3.0.0/modules/proto_smpp/smpp.c:766: first defined here
/usr/bin/ld: smpp.csmpp.o: in function `handle_generic_nack_cmd':
/home/volga629/rpmbuild/BUILD/opensips-3.0.0/modules/proto_smpp/smpp.csmpp.c:785: multiple definition of `handle_generic_nack_cmd'; smpp.o:/home/volga629/rpmbuild/BUILD/opensips-3.0.0/modules/proto_smpp/smpp.c:785: first defined here
/usr/bin/ld: smpp.csmpp.o: in function `handle_bind_receiver_cmd':
/home/volga629/rpmbuild/BUILD/opensips-3.0.0/modules/proto_smpp/smpp.csmpp.c:790: multiple definition of `handle_bind_receiver_cmd'; smpp.o:/home/volga629/rpmbuild/BUILD/opensips-3.0.0/modules/proto_smpp/smpp.c:790: first defined here
/usr/bin/ld: smpp.csmpp.o: in function `handle_bind_receiver_resp_cmd':
/home/volga629/rpmbuild/BUILD/opensips-3.0.0/modules/proto_smpp/smpp.csmpp.c:805: multiple definition of `handle_bind_receiver_resp_cmd'; smpp.o:/home/volga629/rpmbuild/BUILD/opensips-3.0.0/modules/proto_smpp/smpp.c:805: first defined here
/usr/bin/ld: smpp.csmpp.o: in function `handle_bind_transmitter_cmd':
/home/volga629/rpmbuild/BUILD/opensips-3.0.0/modules/proto_smpp/smpp.csmpp.c:814: multiple definition of `handle_bind_transmitter_cmd'; smpp.o:/home/volga629/rpmbuild/BUILD/opensips-3.0.0/modules/proto_smpp/smpp.c:814: first defined here
/usr/bin/ld: smpp.csmpp.o: in function `handle_bind_transmitter_resp_cmd':
/home/volga629/rpmbuild/BUILD/opensips-3.0.0/modules/proto_smpp/smpp.csmpp.c:829: multiple definition of `handle_bind_transmitter_resp_cmd'; smpp.o:/home/volga629/rpmbuild/BUILD/opensips-3.0.0/modules/proto_smpp/smpp.c:829: first defined here
/usr/bin/ld: smpp.csmpp.o: in function `handle_submit_or_deliver_cmd':
/home/volga629/rpmbuild/BUILD/opensips-3.0.0/modules/proto_smpp/smpp.csmpp.c:839: multiple definition of `handle_submit_or_deliver_cmd'; smpp.o:/home/volga629/rpmbuild/BUILD/opensips-3.0.0/modules/proto_smpp/smpp.c:839: first defined here
/usr/bin/ld: smpp.csmpp.o: in function `handle_submit_or_deliver_resp_cmd':
/home/volga629/rpmbuild/BUILD/opensips-3.0.0/modules/proto_smpp/smpp.csmpp.c:865: multiple definition of `handle_submit_or_deliver_resp_cmd'; smpp.o:/home/volga629/rpmbuild/BUILD/opensips-3.0.0/modules/proto_smpp/smpp.c:865: first defined here
/usr/bin/ld: smpp.csmpp.o: in function `handle_submit_sm_cmd':
/home/volga629/rpmbuild/BUILD/opensips-3.0.0/modules/proto_smpp/smpp.csmpp.c:879: multiple definition of `handle_submit_sm_cmd'; smpp.o:/home/volga629/rpmbuild/BUILD/opensips-3.0.0/modules/proto_smpp/smpp.c:879: first defined here
/usr/bin/ld: smpp.csmpp.o: in function `handle_smpp_msg':
/home/volga629/rpmbuild/BUILD/opensips-3.0.0/modules/proto_smpp/smpp.csmpp.c:993: multiple definition of `handle_smpp_msg'; smpp.o:/home/volga629/rpmbuild/BUILD/opensips-3.0.0/modules/proto_smpp/smpp.c:993: first defined here
/usr/bin/ld: smpp.csmpp.o: in function `send_submit_or_deliver_request':
/home/volga629/rpmbuild/BUILD/opensips-3.0.0/modules/proto_smpp/smpp.csmpp.c:1060: multiple definition of `send_submit_or_deliver_request'; smpp.o:/home/volga629/rpmbuild/BUILD/opensips-3.0.0/modules/proto_smpp/smpp.c:1060: first defined here
/usr/bin/ld: smpp.csmpp.o: in function `smpp_sessions_init':
/home/volga629/rpmbuild/BUILD/opensips-3.0.0/modules/proto_smpp/smpp.csmpp.c:1144: multiple definition of `smpp_sessions_init'; smpp.o:/home/volga629/rpmbuild/BUILD/opensips-3.0.0/modules/proto_smpp/smpp.c:1144: first defined here
/usr/bin/ld: smpp.csmpp.o: in function `smpp_session_new':
/home/volga629/rpmbuild/BUILD/opensips-3.0.0/modules/proto_smpp/smpp.csmpp.c:1161: multiple definition of `smpp_session_new'; smpp.o:/home/volga629/rpmbuild/BUILD/opensips-3.0.0/modules/proto_smpp/smpp.c:1161: first defined here
/usr/bin/ld: smpp.csmpp.o: in function `smpp_session_get':
/home/volga629/rpmbuild/BUILD/opensips-3.0.0/modules/proto_smpp/smpp.csmpp.c:1220: multiple definition of `smpp_session_get'; smpp.o:/home/volga629/rpmbuild/BUILD/opensips-3.0.0/modules/proto_smpp/smpp.c:1220: first defined here
collect2: error: ld returned 1 exit status
make[1]: *** [../../Makefile.rules:39: proto_smpp.so] Error 1
make[1]: Leaving directory '/home/volga629/rpmbuild/BUILD/opensips-3.0.0/modules/proto_smpp'
make: *** [Makefile:200: modules] Error 2
error: Bad exit status from /var/tmp/rpm-tmp.xg7p0L (%build)
```

**Comment by volga629** [comment]
This last patch causing issue 


```
[volga629@canldev01-fedora29 SPECS]$ cat ../SOURCES/opensips-3.0.0-proto_smpp-github1728-smpp.c.patch
--- a/modules/proto_smpp/smpp.c	2019-07-05 12:13:35.608155898 -0400
+++ b/modules/proto_smpp/smpp.c	2019-07-05 12:16:47.813069825 -0400
@@ -521,7 +521,7 @@
 	/* TBD - handle conn not found here = reconnect ? */
 	ret = tcp_conn_get(smsc->conn_id, &smsc->ip, smsc->port, PROTO_SMPP,
 		NULL, &conn, &fd);
-	if (ret <= 0 || bind_session(smsc) < 0) {
+	if (ret <= 0 && bind_session(smsc) < 0) {
 		LM_ERR("cannot fetch connection for %.*s (%d)\n",
 				smsc->name.len, smsc->name.s, ret);
 		return -1;
```

**Comment by volga629** [comment]
I manage to compile but it causing segfault 

```

Jul  5 11:10:34 smsc /usr/sbin/opensips[19663]: INFO:core:probe_max_sock_buff: using snd buffer of 416 kb
Jul  5 11:10:34 smsc /usr/sbin/opensips[19663]: INFO:core:init_sock_keepalive: TCP keepalive enabled on socket 5
Jul  5 11:10:34 smsc /usr/sbin/opensips[19663]: INFO:proto_smpp:smpp_conn_init: smpp_conn_init called
Jul  5 11:10:34 smsc /usr/sbin/opensips[19663]: ERROR:core:tsend_stream: tsend_stream: failed to send: (9) Bad file descriptor
Jul  5 11:10:34 smsc /usr/sbin/opensips[19663]: CRITICAL:core:sig_usr: segfault in process pid: 19663, id: 10
```

**Comment by volga629** [comment]
Hello Razvan,
Can you please verify last patch that i can continue testing.
Thank you.

**Comment by johandeclercqdemocon** [comment]
can you please provide a full back trace ?

**Comment by volga629** [comment]
I am waiting for Razvan to review last diff, which cause segfault

**Comment by razvancrainea** [comment]
I actually need to revise the entire connections management, to make sure it supports these reconnects properly. I will try to prioritize this, will let you know my findings.

**Comment by volga629** [comment]
This is core dump

```
[root@smsc ccpp-2019-07-12-05:33:00.668755-1762]# gdb coredump
GNU gdb (GDB) Fedora 8.2-7.fc29
Copyright (C) 2018 Free Software Foundation, Inc.
License GPLv3+: GNU GPL version 3 or later <http://gnu.org/licenses/gpl.html>
This is free software: you are free to change and redistribute it.
There is NO WARRANTY, to the extent permitted by law.
Type "show copying" and "show warranty" for details.
This GDB was configured as "x86_64-redhat-linux-gnu".
Type "show configuration" for configuration details.
For bug reporting instructions, please see:
<http://www.gnu.org/software/gdb/bugs/>.
Find the GDB manual and other documentation resources online at:
    <http://www.gnu.org/software/gdb/documentation/>.

For help, type "help".
Type "apropos word" to search for commands related to "word"...
[New LWP 1762]
Reading symbols from /usr/sbin/opensips...Reading symbols from /usr/lib/debug/usr/sbin/opensips-3.0.0-7.fc29.x86_64.debug...done.
done.

warning: Ignoring non-absolute filename: <linux-vdso.so.1>
Missing separate debuginfo for linux-vdso.so.1
Try: dnf --enablerepo='*debug*' install /usr/lib/debug/.build-id/bc/c6b3cc1ffdee91c4c89bbc00d0e5447a1d7060
Missing separate debuginfo for /usr/lib64/opensips/modules/db_mysql.so
Try: dnf --enablerepo='*debug*' install /usr/lib/debug/.build-id/5f/b7c8900c2975c78a62d889ae2d22e03c5c73ad
Missing separate debuginfo for /usr/lib64/opensips/modules/httpd.so
Try: dnf --enablerepo='*debug*' install /usr/lib/debug/.build-id/36/730050b3cafaede543e10d60cebca690b18c65
Missing separate debuginfo for /usr/lib64/opensips/modules/db_mysql.so
Try: dnf --enablerepo='*debug*' install /usr/lib/debug/.build-id/5f/b7c8900c2975c78a62d889ae2d22e03c5c73ad.debug
[Thread debugging using libthread_db enabled]
Using host libthread_db library "/lib64/libthread_db.so.1".

warning: Loadable section ".note.gnu.property" outside of ELF segments

warning: Loadable section ".note.gnu.property" outside of ELF segments
Missing separate debuginfo for /usr/lib64/opensips/modules/httpd.so
Try: dnf --enablerepo='*debug*' install /usr/lib/debug/.build-id/36/730050b3cafaede543e10d60cebca690b18c65.debug

warning: Loadable section ".note.gnu.property" outside of ELF segments

warning: Loadable section ".note.gnu.property" outside of ELF segments

warning: Loadable section ".note.gnu.property" outside of ELF segments

warning: Loadable section ".note.gnu.property" outside of ELF segments

warning: Loadable section ".note.gnu.property" outside of ELF segments

warning: Loadable section ".note.gnu.property" outside of ELF segments

warning: Loadable section ".note.gnu.property" outside of ELF segments

warning: Loadable section ".note.gnu.property" outside of ELF segments

warning: Loadable section ".note.gnu.property" outside of ELF segments

warning: Loadable section ".note.gnu.property" outside of ELF segments

warning: Loadable section ".note.gnu.property" outside of ELF segments

warning: Loadable section ".note.gnu.property" outside of ELF segments

warning: Loadable section ".note.gnu.property" outside of ELF segments
Core was generated by `/usr/sbin/opensips -P /run/opensips/opensips.pid -f /etc/opensips/opensips.cfg'.
Program terminated with signal SIGSEGV, Segmentation fault.
#0  smpp_send_msg (smsc=smsc@entry=0x7f3e54bdda38, buffer=<optimized out>, buffer=<optimized out>) at smpp.c:531
531		tcp_conn_set_lifetime(conn, tcp_con_lifetime);
Missing separate debuginfos, use: dnf debuginfo-install glibc-2.28-30.fc29.x86_64 gmp-6.1.2-9.fc29.x86_64 gnutls-3.6.7-1.fc29.x86_64 libffi-3.1-18.fc29.x86_64 libidn2-2.1.1a-1.fc29.x86_64 libmicrohttpd-0.9.63-1.fc29.x86_64 libtasn1-4.13-5.fc29.x86_64 libunistring-0.9.10-4.fc29.x86_64 mariadb-connector-c-3.0.10-1.fc29.x86_64 nettle-3.4.1rc1-1.fc29.x86_64 openssl-libs-1.1.1b-5.fc29.x86_64 p11-kit-0.23.15-2.fc29.x86_64 zlib-1.2.11-14.fc29.x86_64
(gdb) bt
#0  smpp_send_msg (smsc=smsc@entry=0x7f3e54bdda38, buffer=<optimized out>, buffer=<optimized out>) at smpp.c:531
#1  0x00007f3e53a47d35 in send_enquire_link_request (session=0x7f3e54bdda38) at smpp.c:1095
#2  enquire_link (ticks=<optimized out>, params=<optimized out>) at smpp.c:620
#3  0x0000557365a200da in handle_timer_job () at timer.c:863
#4  0x0000557365b15b15 in handle_io (fm=0x7f3e74828330, idx=idx@entry=3, event_type=event_type@entry=1) at net/net_tcp_proc.c:194
#5  0x0000557365b17de8 in io_wait_loop_epoll (h=<optimized out>, t=<optimized out>, repeat=<optimized out>) at net/../io_wait_loop.h:280
#6  tcp_worker_proc_loop () at net/net_tcp_proc.c:411
#7  0x0000557365b28024 in tcp_start_processes (chd_rank=chd_rank@entry=0x557365c198fc <chd_rank>, startup_done=startup_done@entry=0x0) at net/net_tcp.c:2075
#8  0x00005573659af5ad in main_loop () at main.c:801
#9  main (argc=<optimized out>, argv=<optimized out>) at main.c:1480
(gdb) bt full
#0  smpp_send_msg (smsc=smsc@entry=0x7f3e54bdda38, buffer=<optimized out>, buffer=<optimized out>) at smpp.c:531
        _timeout = 135
        ret = -1
        fd = -1
        conn = 0x0
        __FUNCTION__ = "smpp_send_msg"
#1  0x00007f3e53a47d35 in send_enquire_link_request (session=0x7f3e54bdda38) at smpp.c:1095
        req = 0x7f3e74ec2590
        req = <optimized out>
        __FUNCTION__ = "send_enquire_link_request"
        __mptr = <optimized out>
#2  enquire_link (ticks=<optimized out>, params=<optimized out>) at smpp.c:620
        l = 0x7f3e54bddad8
        session = 0x7f3e54bdda38
#3  0x0000557365a200da in handle_timer_job () at timer.c:863
        t = 0x7f3e54bae158
        l = <optimized out>
        __FUNCTION__ = "handle_timer_job"
#4  0x0000557365b15b15 in handle_io (fm=0x7f3e74828330, idx=idx@entry=3, event_type=event_type@entry=1) at net/net_tcp_proc.c:194
        ret = 0
        n = <optimized out>
        con = <optimized out>
        s = 32574
        rw = <optimized out>
        resp = <optimized out>
        response = {139906226333504, 139906226331232}
        __FUNCTION__ = "handle_io"
#5  0x0000557365b17de8 in io_wait_loop_epoll (h=<optimized out>, t=<optimized out>, repeat=<optimized out>) at net/../io_wait_loop.h:280
        ret = <optimized out>
        i = <optimized out>
        e = <optimized out>
        ep_event = {events = 8, data = {ptr = 0x3c6fad0000000030, fd = 48, u32 = 48, u64 = 4354889580202164272}}
        fd = <optimized out>
        n = 1
        r = 3
        ret = <optimized out>
        n = <optimized out>
        r = <optimized out>
        i = <optimized out>
        e = <optimized out>
        ep_event = <optimized out>
--Type <RET> for more, q to quit, c to continue without paging-- 
        fd = <optimized out>
        __FUNCTION__ = "io_wait_loop_epoll"
#6  tcp_worker_proc_loop () at net/net_tcp_proc.c:411
        __FUNCTION__ = "tcp_worker_proc_loop"
#7  0x0000557365b28024 in tcp_start_processes (chd_rank=chd_rank@entry=0x557365c198fc <chd_rank>, startup_done=startup_done@entry=0x0) at net/net_tcp.c:2075
        r = <optimized out>
        n = <optimized out>
        p_id = <optimized out>
        reader_fd = {113, 114}
        si = <optimized out>
        __FUNCTION__ = "tcp_start_processes"
#8  0x00005573659af5ad in main_loop () at main.c:801
        startup_done = 0x0
        last_check = 0
        rc = <optimized out>
        chd_rank = 11
        startup_done = <optimized out>
        last_check = <optimized out>
        rc = <optimized out>
        __FUNCTION__ = "main_loop"
#9  main (argc=<optimized out>, argv=<optimized out>) at main.c:1480
        c = <optimized out>
        r = <optimized out>
        tmp = 0x7ffc0f668efe ""
        tmp_len = <optimized out>
        port = <optimized out>
        proto = <optimized out>
        protos_no = <optimized out>
        options = 0x557365b5f988 "f:cCm:M:b:l:n:N:rRvdDFEVhw:t:u:g:p:P:G:W:o:a:k:s:"
        seed = 3051123131
        rfd = <optimized out>
        __FUNCTION__ = "main"
(gdb) 

```

**Comment by osgjps** [comment]
I ran across this same segfault issue, but I corrected it with a simple change.  in  send_submit_or_deliver_resp(), I changed:

smpp_send_msg(session, &req->payload);

to

smpp_send_msg(session, &resp->payload);

That cured the segfault issue and made it so I could at least receive SMPP messages without opensips crashing.

**Comment by johandeclercqdemocon** [comment]
Hello, does sending out SMS's works also now ?

BR, Johan.

Op ma 15 jul. 2019 om 01:02 schreef osgjps <notifications@github.com>:

**Comment by osgjps** [comment]
Yes.  I have been able to send and receive SMS messages via my OpenMarket account.

**Comment by johandeclercqdemocon** [comment]
Thanks I will try tomorrow.

Outlook voor iOS<https://aka.ms/o0ukef> downloaden

________________________________
Van: osgjps <notifications@github.com>
Verzonden: maandag, juli 15, 2019 6:48 PM
Aan: OpenSIPS/opensips
CC: johandeclercqdemocon; Comment
Onderwerp: Re: [OpenSIPS/opensips] [BUG] SMPP trunk (#1728)


Yes. I have been able to send and receive SMS messages via my OpenMarket account.

**Comment by volga629** [comment]
What line you changed in smpp.c ?

This line

```
 843         send_submit_or_deliver_resp(&req, session)

```

Compiler failing 

smpp.c:780:26: error: 'resp' undeclared (first use in this function); did you mean 'req'?
  smpp_send_msg(session, &resp->payload);
                          ^~~~

**Comment by osgjps** [comment]
Not line 780.  My change is on line 740 in the send_submit_or_deliver_resp() function.

**Comment by volga629** [comment]
In my 3.0.0 

```
 722         }
 723 
 724         smpp_send_msg(session, &req->payload);
 725         pkg_free(resp);
 726 }
 727 
 728 uint32_t bind_session(smpp_bind_transceiver_t *body, smpp_session_t *session)
 729 {
 730         if (memcmp(session->bind.transceiver.system_id, body->system_id, MAX_SYSTEM_ID_LEN) != 0) {
 731                 LM_WARN("wrong system id when trying to bind \"%.*s\"\n", MAX_SYSTEM_ID_LEN, body->system_id);
 732                 return ESME_RBINDFAIL;
 733         }
 734 
 735         if (memcmp(session->bind.transceiver.password, body->password, MAX_PASSWORD_LEN) != 0) {
 736                 LM_WARN("wrong password when trying to bind \"%.*s\"\n", MAX_SYSTEM_ID_LEN, body->system_id);
 737                 return ESME_RBINDFAIL;
 738         }
 739         if (session->session_type != SMPP_OUTBIND) {
 740                 LM_WARN("cannot receive bind command on ESME type interface for \"%.*s\"\n",
 741                                 MAX_SYSTEM_ID_LEN, body->system_id);
 742                 return ESME_RBINDFAIL;
 743         }
 744         LM_INFO("successfully found \"%.*s\"\n", MAX_SYSTEM_ID_LEN, body->system_id);
 745         return ESME_ROK;
 746 }
 747 
 748 void send_bind_resp
```

**Comment by osgjps** [comment]
I'm working from git master.

**Comment by johandeclercqdemocon** [comment]
Is 3.0 the current master branch?

Outlook voor iOS<https://aka.ms/o0ukef> downloaden

________________________________
Van: osgjps <notifications@github.com>
Verzonden: maandag, juli 15, 2019 7:51 PM
Aan: OpenSIPS/opensips
CC: johandeclercqdemocon; Comment
Onderwerp: Re: [OpenSIPS/opensips] [BUG] SMPP trunk (#1728)


I'm working from git master.

**Comment by volga629** [comment]
Thank you I found. generating rpms right now

**Comment by johandeclercqdemocon** [comment]
I think that you need to upgrade to latest 3.0, volga629

Outlook voor iOS<https://aka.ms/o0ukef> downloaden

________________________________
Van: volga629 <notifications@github.com>
Verzonden: maandag, juli 15, 2019 7:46 PM
Aan: OpenSIPS/opensips
CC: johandeclercqdemocon; Comment
Onderwerp: Re: [OpenSIPS/opensips] [BUG] SMPP trunk (#1728)


In my 3.0.0

 722         }
 723
 724         smpp_send_msg(session, &req->payload);
 725         pkg_free(resp);
 726 }
 727
 728 uint32_t bind_session(smpp_bind_transceiver_t *body, smpp_session_t *session)
 729 {
 730         if (memcmp(session->bind.transceiver.system_id, body->system_id, MAX_SYSTEM_ID_LEN) != 0) {
 731                 LM_WARN("wrong system id when trying to bind \"%.*s\"\n", MAX_SYSTEM_ID_LEN, body->system_id);
 732                 return ESME_RBINDFAIL;
 733         }
 734
 735         if (memcmp(session->bind.transceiver.password, body->password, MAX_PASSWORD_LEN) != 0) {
 736                 LM_WARN("wrong password when trying to bind \"%.*s\"\n", MAX_SYSTEM_ID_LEN, body->system_id);
 737                 return ESME_RBINDFAIL;
 738         }
 739         if (session->session_type != SMPP_OUTBIND) {
 740                 LM_WARN("cannot receive bind command on ESME type interface for \"%.*s\"\n",
 741                                 MAX_SYSTEM_ID_LEN, body->system_id);
 742                 return ESME_RBINDFAIL;
 743         }
 744         LM_INFO("successfully found \"%.*s\"\n", MAX_SYSTEM_ID_LEN, body->system_id);
 745         return ESME_ROK;
 746 }
 747
 748 void send_bind_resp

**Comment by volga629** [comment]
I tested the fix, but segfault still occur 

```
Jul 15 23:28:35 smsc /usr/sbin/opensips[11254]: INFO:proto_smpp:handle_submit_or_deliver_resp_cmd: Successfully sent message "10915574-0cb5-494d-a3cf-56e2f37f9512"
Jul 15 23:28:44 smsc /usr/sbin/opensips[11243]: INFO:core:handle_sigs: child process 11250 exited by a signal 11
Jul 15 23:28:45 smsc /usr/sbin/opensips[11243]: INFO:core:handle_sigs: core was generated
Jul 15 23:28:45 smsc /usr/sbin/opensips[11243]: INFO:core:handle_sigs: terminating due to SIGCHLD
Jul 15 23:28:45 smsc /usr/sbin/opensips[11246]: INFO:core:sig_usr: signal 15 received
Jul 15 23:28:45 smsc /usr/sbin/opensips[11247]: INFO:core:sig_usr: signal 15 received
Jul 15 23:28:45 smsc /usr/sbin/opensips[11252]: CRITICAL:core:sig_usr: segfault in process pid: 11252, id: 9
```

**Comment by volga629** [comment]
```
warning: Loadable section ".note.gnu.property" outside of ELF segments
Core was generated by `/usr/sbin/opensips -P /run/opensips/opensips.pid -f /etc/opensips/opensips.cfg'.
Program terminated with signal SIGSEGV, Segmentation fault.
#0  fm_status (fm=0x7f334ab5c010) at mem/f_malloc_dyn.h:482
482					size+=f->size,f=f->u.nxt_free,i++,j++){ }
Missing separate debuginfos, use: dnf debuginfo-install glibc-2.28-30.fc29.x86_64 gmp-6.1.2-9.fc29.x86_64 gnutls-3.6.7-1.fc29.x86_64 libffi-3.1-18.fc29.x86_64 libidn2-2.1.1a-1.fc29.x86_64 libmicrohttpd-0.9.63-1.fc29.x86_64 libtasn1-4.13-5.fc29.x86_64 libunistring-0.9.10-4.fc29.x86_64 mariadb-connector-c-3.0.10-1.fc29.x86_64 nettle-3.4.1rc1-1.fc29.x86_64 openssl-libs-1.1.1b-5.fc29.x86_64 p11-kit-0.23.15-2.fc29.x86_64 zlib-1.2.11-14.fc29.x86_64
(gdb) bt
#0  fm_status (fm=0x7f334ab5c010) at mem/f_malloc_dyn.h:482
#1  0x00005633046c399d in rpc_process_terminate (sender_id=<optimized out>, code=0x0) at main.c:445
#2  0x0000563304681bca in ipc_handle_job (fd=<optimized out>) at ipc.c:218
#3  0x0000563304788c30 in handle_io (idx=1, event_type=1, fm=0x7f334abac588) at net/net_udp.c:288
#4  io_wait_loop_epoll (repeat=0, t=1, h=<optimized out>) at net/../io_wait_loop.h:280
#5  0x000056330478d572 in udp_start_processes (chd_rank=chd_rank@entry=0x5633048978dc <chd_rank>, startup_done=startup_done@entry=0x0) at net/net_udp.c:496
#6  0x000056330462d596 in main_loop () at main.c:795
#7  main (argc=<optimized out>, argv=<optimized out>) at main.c:1480
(gdb) bt full
#0  fm_status (fm=0x7f334ab5c010) at mem/f_malloc_dyn.h:482
        f = 0x6f68732061636972
        i = <optimized out>
        j = 1
        h = 5
        unused = 0
        size = 7308569377990731912
        __FUNCTION__ = "fm_status"
#1  0x00005633046c399d in rpc_process_terminate (sender_id=<optimized out>, code=0x0) at main.c:445
        __FUNCTION__ = "rpc_process_terminate"
#2  0x0000563304681bca in ipc_handle_job (fd=<optimized out>) at ipc.c:218
        job = {snd_proc = 0, handler_type = 0, payload1 = 0x5633046c38f0 <rpc_process_terminate>, payload2 = 0x0}
        n = <optimized out>
        __FUNCTION__ = "ipc_handle_job"
#3  0x0000563304788c30 in handle_io (idx=1, event_type=1, fm=0x7f334abac588) at net/net_udp.c:288
        n = 0
        read = 22067
        n = <optimized out>
        read = <optimized out>
        __FUNCTION__ = "handle_io"
#4  io_wait_loop_epoll (repeat=0, t=1, h=<optimized out>) at net/../io_wait_loop.h:280
        ret = <optimized out>
        n = 1
        r = 1
        i = <optimized out>
        e = 0x7f334abac588
        ep_event = {events = 73900685, data = {ptr = 0x4ab827f000005633, fd = 22067, u32 = 22067, u64 = 5384097266267084339}}
        fd = <optimized out>
        __FUNCTION__ = "io_wait_loop_epoll"
#5  0x000056330478d572 in udp_start_processes (chd_rank=chd_rank@entry=0x5633048978dc <chd_rank>, startup_done=startup_done@entry=0x0) at net/net_udp.c:496
        si = 0x7f334ab827f0
        p_id = <optimized out>
        i = 1
        p = <optimized out>
        __FUNCTION__ = "udp_start_processes"
#6  0x000056330462d596 in main_loop () at main.c:795
        startup_done = 0x0
        last_check = 0
        rc = <optimized out>
        chd_rank = 2
        startup_done = <optimized out>
--Type <RET> for more, q to quit, c to continue without paging--
        last_check = <optimized out>
        rc = <optimized out>
        __FUNCTION__ = "main_loop"
#7  main (argc=<optimized out>, argv=<optimized out>) at main.c:1480
        c = <optimized out>
        r = <optimized out>
        tmp = 0x7ffcc48b5efd ""
        tmp_len = <optimized out>
        port = <optimized out>
        proto = <optimized out>
        protos_no = <optimized out>
        options = 0x5633047dd6c8 "f:cCm:M:b:l:n:N:rRvdDFEVhw:t:u:g:p:P:G:W:o:a:k:s:"
        seed = 2290329200
        rfd = <optimized out>
        __FUNCTION__ = "main"
```

**Comment by johandeclercqdemocon** [comment]
Pffff, That’s probably memory management. Osgjps: what os do you use? Stretch?

Outlook voor iOS<https://aka.ms/o0ukef> downloaden

________________________________
Van: volga629 <notifications@github.com>
Verzonden: dinsdag, juli 16, 2019 6:08 AM
Aan: OpenSIPS/opensips
CC: johandeclercqdemocon; Comment
Onderwerp: Re: [OpenSIPS/opensips] [BUG] SMPP trunk (#1728)


warning: Loadable section ".note.gnu.property" outside of ELF segments
Core was generated by `/usr/sbin/opensips -P /run/opensips/opensips.pid -f /etc/opensips/opensips.cfg'.
Program terminated with signal SIGSEGV, Segmentation fault.
#0  fm_status (fm=0x7f334ab5c010) at mem/f_malloc_dyn.h:482
482                                     size+=f->size,f=f->u.nxt_free,i++,j++){ }
Missing separate debuginfos, use: dnf debuginfo-install glibc-2.28-30.fc29.x86_64 gmp-6.1.2-9.fc29.x86_64 gnutls-3.6.7-1.fc29.x86_64 libffi-3.1-18.fc29.x86_64 libidn2-2.1.1a-1.fc29.x86_64 libmicrohttpd-0.9.63-1.fc29.x86_64 libtasn1-4.13-5.fc29.x86_64 libunistring-0.9.10-4.fc29.x86_64 mariadb-connector-c-3.0.10-1.fc29.x86_64 nettle-3.4.1rc1-1.fc29.x86_64 openssl-libs-1.1.1b-5.fc29.x86_64 p11-kit-0.23.15-2.fc29.x86_64 zlib-1.2.11-14.fc29.x86_64
(gdb) bt
#0  fm_status (fm=0x7f334ab5c010) at mem/f_malloc_dyn.h:482
#1  0x00005633046c399d in rpc_process_terminate (sender_id=<optimized out>, code=0x0) at main.c:445
#2  0x0000563304681bca in ipc_handle_job (fd=<optimized out>) at ipc.c:218
#3  0x0000563304788c30 in handle_io (idx=1, event_type=1, fm=0x7f334abac588) at net/net_udp.c:288
#4  io_wait_loop_epoll (repeat=0, t=1, h=<optimized out>) at net/../io_wait_loop.h:280
#5  0x000056330478d572 in udp_start_processes (chd_rank=chd_rank@entry=0x5633048978dc <chd_rank>, startup_done=startup_done@entry=0x0) at net/net_udp.c:496
#6  0x000056330462d596 in main_loop () at main.c:795
#7  main (argc=<optimized out>, argv=<optimized out>) at main.c:1480
(gdb) bt full
#0  fm_status (fm=0x7f334ab5c010) at mem/f_malloc_dyn.h:482
        f = 0x6f68732061636972
        i = <optimized out>
        j = 1
        h = 5
        unused = 0
        size = 7308569377990731912
        __FUNCTION__ = "fm_status"
#1  0x00005633046c399d in rpc_process_terminate (sender_id=<optimized out>, code=0x0) at main.c:445
        __FUNCTION__ = "rpc_process_terminate"
#2  0x0000563304681bca in ipc_handle_job (fd=<optimized out>) at ipc.c:218
        job = {snd_proc = 0, handler_type = 0, payload1 = 0x5633046c38f0 <rpc_process_terminate>, payload2 = 0x0}
        n = <optimized out>
        __FUNCTION__ = "ipc_handle_job"
#3  0x0000563304788c30 in handle_io (idx=1, event_type=1, fm=0x7f334abac588) at net/net_udp.c:288
        n = 0
        read = 22067
        n = <optimized out>
        read = <optimized out>
        __FUNCTION__ = "handle_io"
#4  io_wait_loop_epoll (repeat=0, t=1, h=<optimized out>) at net/../io_wait_loop.h:280
        ret = <optimized out>
        n = 1
        r = 1
        i = <optimized out>
        e = 0x7f334abac588
        ep_event = {events = 73900685, data = {ptr = 0x4ab827f000005633, fd = 22067, u32 = 22067, u64 = 5384097266267084339}}
        fd = <optimized out>
        __FUNCTION__ = "io_wait_loop_epoll"
#5  0x000056330478d572 in udp_start_processes (chd_rank=chd_rank@entry=0x5633048978dc <chd_rank>, startup_done=startup_done@entry=0x0) at net/net_udp.c:496
        si = 0x7f334ab827f0
        p_id = <optimized out>
        i = 1
        p = <optimized out>
        __FUNCTION__ = "udp_start_processes"
#6  0x000056330462d596 in main_loop () at main.c:795
        startup_done = 0x0
        last_check = 0
        rc = <optimized out>
        chd_rank = 2
        startup_done = <optimized out>
--Type <RET> for more, q to quit, c to continue without paging--
        last_check = <optimized out>
        rc = <optimized out>
        __FUNCTION__ = "main_loop"
#7  main (argc=<optimized out>, argv=<optimized out>) at main.c:1480
        c = <optimized out>
        r = <optimized out>
        tmp = 0x7ffcc48b5efd ""
        tmp_len = <optimized out>
        port = <optimized out>
        proto = <optimized out>
        protos_no = <optimized out>
        options = 0x5633047dd6c8 "f:cCm:M:b:l:n:N:rRvdDFEVhw:t:u:g:p:P:G:W:o:a:k:s:"
        seed = 2290329200
        rfd = <optimized out>
        __FUNCTION__ = "main"

**Comment by osgjps** [comment]
Ubuntu 17.10

**Comment by johandeclercqdemocon** [comment]
sorry guys, I am unable to test as my provider has huge connectivity
problems. I'll let you know the results after these are solved.

Op di 16 jul. 2019 om 08:06 schreef osgjps <notifications@github.com>:

**Comment by johandeclercqdemocon** [comment]
In addition, 

 

Jul 17 12:03:35 hendrix /data/opensips/sbin/opensips[11483]: CRITICAL:core:sig_usr: segfault in process pid: 11483, id: 5

Jul 17 12:03:35 hendrix kernel: [578679.073629] opensips[11483]: segfault at a4 ip 00007f2dd86544c3 sp 00007ffcd46d31d0 error 4 in proto_smpp.so[7f2dd864b000+15000]

**Comment by razvancrainea** [comment]
@johandeclercqdemocon I've pushed a fix for this a couple of hours ago - can you please update your sources and check again?

**Comment by johandeclercqdemocon** [comment]
Hello Razvan, 

 

Is rebuilding proto_smpp sufficient ?

**Comment by volga629** [comment]
> @johandeclercqdemocon I've pushed a fix for this a couple of hours ago - can you please update your sources and check again?

If this line removed 

```
if (ret <= 0 && bind_session(smsc) < 0) {

```
compiler failing

**Comment by razvancrainea** [comment]
@johandeclercqdemocon yes, rebuilding proto_smpp should be enough.

**Comment by volga629** [comment]
> /bin/ld: smpp.csmpp.o: in function `send_submit_or_deliver_resp':
> /home/volga629/rpmbuild/BUILD/opensips-3.0.0/modules/proto_smpp/smpp.csmpp.c:725: multiple definition of `send_submit_or_deliver_resp'; smpp.o:/home/volga629/rpmbuild/BUILD/opensips-3.0.0/modules/proto_smpp/smpp.c:725: first defined here
> /usr/bin/ld: smpp.csmpp.o: in function `check_bind_session':
> /home/volga629/rpmbuild/BUILD/opensips-3.0.0/modules/proto_smpp/smpp.csmpp.c:745: multiple definition of `check_bind_session'; smpp.o:/home/volga629/rpmbuild/BUILD/opensips-3.0.0/modules/proto_smpp/smpp.c:745: first defined here
> /usr/bin/ld: smpp.csmpp.o: in function `send_bind_resp':
> /home/volga629/rpmbuild/BUILD/opensips-3.0.0/modules/proto_smpp/smpp.csmpp.c:766: multiple definition of `send_bind_resp'; smpp.o:/home/volga629/rpmbuild/BUILD/opensips-3.0.0/modules/proto_smpp/smpp.c:766: first defined here
> /usr/bin/ld: smpp.csmpp.o: in function `handle_generic_nack_cmd':
> /home/volga629/rpmbuild/BUILD/opensips-3.0.0/modules/proto_smpp/smpp.csmpp.c:785: multiple definition of `handle_generic_nack_cmd'; smpp.o:/home/volga629/rpmbuild/BUILD/opensips-3.0.0/modules/proto_smpp/smpp.c:785: first defined here
> /usr/bin/ld: smpp.csmpp.o: in function `handle_bind_receiver_cmd':
> /home/volga629/rpmbuild/BUILD/opensips-3.0.0/modules/proto_smpp/smpp.csmpp.c:790: multiple definition of `handle_bind_receiver_cmd'; smpp.o:/home/volga629/rpmbuild/BUILD/opensips-3.0.0/modules/proto_smpp/smpp.c:790: first defined here
> /usr/bin/ld: smpp.csmpp.o: in function `handle_bind_receiver_resp_cmd':
> /home/volga629/rpmbuild/BUILD/opensips-3.0.0/modules/proto_smpp/smpp.csmpp.c:805: multiple definition of `handle_bind_receiver_resp_cmd'; smpp.o:/home/volga629/rpmbuild/BUILD/opensips-3.0.0/modules/proto_smpp/smpp.c:805: first defined here
> /usr/bin/ld: smpp.csmpp.o: in function `handle_bind_transmitter_cmd':
> /home/volga629/rpmbuild/BUILD/opensips-3.0.0/modules/proto_smpp/smpp.csmpp.c:814: multiple definition of `handle_bind_transmitter_cmd'; smpp.o:/home/volga629/rpmbuild/BUILD/opensips-3.0.0/modules/proto_smpp/smpp.c:814: first defined here
> /usr/bin/ld: smpp.csmpp.o: in function `handle_bind_transmitter_resp_cmd':
> /home/volga629/rpmbuild/BUILD/opensips-3.0.0/modules/proto_smpp/smpp.csmpp.c:829: multiple definition of `handle_bind_transmitter_resp_cmd'; smpp.o:/home/volga629/rpmbuild/BUILD/opensips-3.0.0/modules/proto_smpp/smpp.c:829: first defined here
> /usr/bin/ld: smpp.csmpp.o: in function `handle_submit_or_deliver_cmd':
> /home/volga629/rpmbuild/BUILD/opensips-3.0.0/modules/proto_smpp/smpp.csmpp.c:839: multiple definition of `handle_submit_or_deliver_cmd'; smpp.o:/home/volga629/rpmbuild/BUILD/opensips-3.0.0/modules/proto_smpp/smpp.c:839: first defined here
> /usr/bin/ld: smpp.csmpp.o: in function `handle_submit_or_deliver_resp_cmd':
> /home/volga629/rpmbuild/BUILD/opensips-3.0.0/modules/proto_smpp/smpp.csmpp.c:865: multiple definition of `handle_submit_or_deliver_resp_cmd'; smpp.o:/home/volga629/rpmbuild/BUILD/opensips-3.0.0/modules/proto_smpp/smpp.c:865: first defined here
> /usr/bin/ld: smpp.csmpp.o: in function `handle_submit_sm_cmd':
> /home/volga629/rpmbuild/BUILD/opensips-3.0.0/modules/proto_smpp/smpp.csmpp.c:879: multiple definition of `handle_submit_sm_cmd'; smpp.o:/home/volga629/rpmbuild/BUILD/opensips-3.0.0/modules/proto_smpp/smpp.c:879: first defined here
> /usr/bin/ld: smpp.csmpp.o: in function `handle_smpp_msg':
> /home/volga629/rpmbuild/BUILD/opensips-3.0.0/modules/proto_smpp/smpp.csmpp.c:993: multiple definition of `handle_smpp_msg'; smpp.o:/home/volga629/rpmbuild/BUILD/opensips-3.0.0/modules/proto_smpp/smpp.c:993: first defined here
> /usr/bin/ld: smpp.csmpp.o: in function `send_submit_or_deliver_request':
> /home/volga629/rpmbuild/BUILD/opensips-3.0.0/modules/proto_smpp/smpp.csmpp.c:1060: multiple definition of `send_submit_or_deliver_request'; smpp.o:/home/volga629/rpmbuild/BUILD/opensips-3.0.0/modules/proto_smpp/smpp.c:1060: first defined here
> /usr/bin/ld: smpp.csmpp.o: in function `smpp_sessions_init':
> /home/volga629/rpmbuild/BUILD/opensips-3.0.0/modules/proto_smpp/smpp.csmpp.c:1144: multiple definition of `smpp_sessions_init'; smpp.o:/home/volga629/rpmbuild/BUILD/opensips-3.0.0/modules/proto_smpp/smpp.c:1144: first defined here
> /usr/bin/ld: smpp.csmpp.o: in function `smpp_session_new':
> /home/volga629/rpmbuild/BUILD/opensips-3.0.0/modules/proto_smpp/smpp.csmpp.c:1161: multiple definition of `smpp_session_new'; smpp.o:/home/volga629/rpmbuild/BUILD/opensips-3.0.0/modules/proto_smpp/smpp.c:1161: first defined here
> /usr/bin/ld: smpp.csmpp.o: in function `smpp_session_get':
> /home/volga629/rpmbuild/BUILD/opensips-3.0.0/modules/proto_smpp/smpp.csmpp.c:1220: multiple definition of `smpp_session_get'; smpp.o:/home/volga629/rpmbuild/BUILD/opensips-3.0.0/modules/proto_smpp/smpp.c:1220: first defined here
> collect2: error: ld returned 1 exit status
> make[1]: *** [../../Makefile.rules:39: proto_smpp.so] Error 1
> make[1]: Leaving directory '/home/volga629/rpmbuild/BUILD/opensips-3.0.0/modules/proto_smpp'
> make: *** [Makefile:200: modules] Error 2
> error: Bad exit status from /var/tmp/rpm-tmp.xg7p0L (%build)

That error

**Comment by johandeclercqdemocon** [comment]
No issue on stretch: it does compile as normal. 

 

/usr/src/opensips-3.0/modules/proto_smpp# make

grep: Makefile.conf: No such file or directory

../../Makefile.modules:19: "you should run make from the main opensips directory"

grep: Makefile.conf: No such file or directory

../../Makefile.modules:19: "you should run make from the main opensips directory"

Compiling smpp.c

gcc -fPIC -DPIC -g -O9 -funroll-loops -Wcast-align -Wall -minline-all-stringops -falign-loops -ftree-vectorize -mtune=nocona -Wold-style-definition -Wmissing-field-initializers -Wredundant-decls  -DMOD_NAME='proto_smpp' -DQ_MALLOC  -DNAME='"opensips"' -DVERSION='"3.0.0"' -DARCH='"x86_64"' -DOS='"linux"' -DCOMPILER='"gcc 6.3.0"' -D__CPU_x86_64 -D__OS_linux -D__SMP_yes -DCFG_DIR='"/usr/local/etc/opensips/"'  -DFAST_LOCK -DADAPTIVE_WAIT -DADAPTIVE_WAIT_LOOPS=1024 -DHAVE_GETHOSTBYNAME2 -DHAVE_UNION_SEMUN -DHAVE_SCHED_YIELD -DHAVE_MSG_NOSIGNAL -DHAVE_MSGHDR_MSG_CONTROL -DHAVE_ALLOCA_H -DHAVE_TIMEGM -DHAVE_EPOLL -DHAVE_SIGIO_RT -DHAVE_SELECT -DPKG_MALLOC  -DSHM_MMAP  -DUSE_MCAST  -DDISABLE_NAGLE  -DSTATISTICS  -DHAVE_RESOLV_RES  -DF_MALLOC  -DQ_MALLOC  -DHP_MALLOC  -DDBG_MALLOC  -c smpp.c -o smpp.o

Linking proto_smpp.so

gcc -shared  -Wl,-O2 -Wl,-E   db.o proto_smpp.o smpp.o utils.o   -o proto_smpp.so

**Comment by volga629** [comment]
Strange on Fedora Server 29 is  failing if I add line above it happy

**Comment by johandeclercqdemocon** [comment]
Razvan, 

My crash is fixed. 

Thanks for the swift reply.

**Comment by volga629** [comment]
I think on debian gcc use different flags 

that on fedora 

```
gcc -shared -Wl,-z,relro   -Wl,-z,now -specs=/usr/lib/rpm/redhat/redhat-hardened-ld  -Wl,-E   db.o proto_smpp.o smpp.o smpp.csmpp.o utils.o   -o proto_smpp.so
```

**Comment by johandeclercqdemocon** [comment]
Probably, although that would surprise me.

**Comment by volga629** [comment]
Hello Razvan,
Is possible to do something about compiling problem ? I can't install under fedora 29 anymore.

Thank you

**Comment by razvancrainea** [comment]
@volga629 please let me know what compiler you are using gcc vs clang and what's the version you are using.
Also, did you try to run `make proper` before compiling?

**Comment by volga629** [comment]
rpmbuild use gcc 


```
gcc -shared -Wl,-z,relro   -Wl,-z,now -specs=/usr/lib/rpm/redhat/redhat-hardened-ld  -Wl,-E   db.o proto_smpp.o smpp.o smpp.csmpp.o utils.o   -o proto_smpp.so
```

```
gcc-8.3.1-2.fc29.x86_64

```


if I set 

```
if (ret <= 0 && bind_session(smsc) < 0) {

```
it compiles fine

**Comment by razvancrainea** [comment]
@volga629 I've just compiled the `proto_smpp` module on a Fedora 29 without any issues.
Moreover, the error invoked by gcc doesn't seem to be valid. So my assumption is that there's something wrong with your building environment. Try to build it on a clean system, or make sure you cleanup previous tries.

**Comment by volga629** [comment]
did you tried from rpmbuild with specs file ?

**Comment by razvancrainea** [comment]
yes, it works out just fine.

**Comment by volga629** [comment]
that command exit
environment is clean 
```
[volga629@canldev01-fedora29 proto_smpp]$ gcc -shared -Wl,-z,relro   -Wl,-z,now -specs=/usr/lib/rpm/redhat/redhat-hardened-ld  -Wl,-E   db.o proto_smpp.o smpp.o smpp.csmpp.o utils.o   -o proto_smpp.so
/usr/bin/ld: smpp.csmpp.o: in function `get_payload_from_submit_sm_body':
/home/volga629/rpmbuild/BUILD/opensips-3.0.0/modules/proto_smpp/smpp.csmpp.c:115: multiple definition of `get_payload_from_submit_sm_body'; smpp.o:/home/volga629/rpmbuild/BUILD/opensips-3.0.0/modules/proto_smpp/smpp.c:115: first defined here
/usr/bin/ld: smpp.csmpp.o: in function `get_payload_from_deliver_sm_resp_body':
/home/volga629/rpmbuild/BUILD/opensips-3.0.0/modules/proto_smpp/smpp.csmpp.c:145: mult
```

**Comment by volga629** [comment]
This build section of spec

```
%build
LOCALBASE=/usr NICER=0 CFLAGS="%{optflags} -fgnu89-inline" LDFLAGS="%{?__global_ldflags}" %{?_with_oracle:ORAHOME="$ORACLE_HOME"} %{__make} all %{?_smp_mflags} TLS=1 \
  exclude_modules="%EXCLUDE_MODULES" \
  cfg_target=%{_sysconfdir}/opensips/

```

**Comment by razvancrainea** [comment]
the problem seems to be that you have copied some files in your source tree that shouldn't be there. There's no `smpp.csmpp.c` in the public sources, I bet it's something that you accidentally copied - that's why it says that those functions are duplicated, because they actually are - there should only be `smpp.c`, not sure how `smpp.csmpp.c` appears there.

**Comment by volga629** [comment]
I am not sure from where are the files might from build, but they not in source for sure


```
[volga629@canldev01-fedora29 SOURCES]$ cd opensips-3.0.0/modules/proto_smpp/
[volga629@canldev01-fedora29 proto_smpp]$ ls
db.c  db.h  doc  Makefile  proto_smpp.c  proto_smpp.h  README  smpp.c  smpp.h  utils.c  utils.h

```

**Comment by razvancrainea** [comment]
Perhaps they are hung in the `/home/volga629/rpmbuild/BUILD/opensips-3.0.0/modules/proto_smpp` directory - try removing the `/home/volga629/rpmbuild/BUILD/` and re-compile.

**Comment by volga629** [comment]
Ol I figure out spec file issue. Doing testing.

**Comment by volga629** [comment]
Hello Razvan,
Connection is stable right now we can send and receive without crash. Thank you for great support and work. 
I was wonder if possible get estimation on ticket  https://github.com/OpenSIPS/opensips/issues/1770. That add UTF8 multi language support.

Thank you volga629

**Comment by johandeclercqdemocon** [comment]
volga629, 

I need your help. 
Hello, I have an issue with SMPP. 

This is what I have in the databse (10.3.0.150 is the INBOUND link)

+----+--------------+-------------+------+-----------+----------+-------------+---------+---------+---------+---------+--------------+
| id | name         | ip          | port | system_id | password | system_type | src_ton | src_npi | dst_ton | dst_npi | session_type |
+----+--------------+-------------+------+-----------+----------+-------------+---------+---------+---------+---------+--------------+
|  1 | tralala        | 80.x.y.z| 2775 | BELOUT| yyyy | OTT         |       1 |       1 |       1 |       1 |            1 |
|  2 | tralala INBOUND | 10.3.0.150  | 5062 | xxxx | yyyy | OTT         |       1 |       1 |       1 |       1 |           4   |
+----+--------------+-------------+------+-----------+----------+-------------+---------+---------+---------+---------+--------------+

When I look in the logs :  it seems that opensips doesn't respond to bind-transceiver; tralala (the outbound link ) comes up nicely.   Am I correct that I need to configure an inbound (towards opensips ) smpp link like this ? 

When I do this, I have below output : 

Jul 25 12:55:24 hendrix /data/opensips/sbin/opensips[19637]: DBG:proto_smpp:handle_smpp_msg: Received SMPP command 00000009 Jul 25 12:55:24 hendrix /data/opensips/sbin/opensips[19637]: DBG:proto_smpp:handle_bind_transceiver_cmd: Received bind_transceiver command Jul 25 12:55:24 hendrix /data/opensips/sbin/opensips[19637]: ERROR:proto_smpp:handle_bind_transceiver_cmd: NULL params Jul 25 12:55:24 hendrix /data/opensips/sbin/opensips[19637]: DBG:proto_smpp:smpp_read_req: tcp_read_req end Jul 25 12:55:25 hendrix /data/opensips/sbin/opensips[19638]: DBG:proto_smpp:smpp_read_req: Using the global ( per process ) buff


However in the request that comes in I have below info:

Transmission Control Protocol, Src Port: 38423, Dst Port: 5062, Seq: 1, Ack: 1, Len: 43 Short Message Peer to Peer, Command: Bind_transceiver, Seq: 1, Len: 43
    Length: 43
    Operation: Bind_transceiver (0x00000009)
    Sequence #: 1
    System ID: xxxxx
    Password: yyyy
    System type: OTT
    Version (if): 3.4
    Type of number: International (0x01)
    Numbering plan indicator: ISDN (E163/E164) (0x01)

opensips has following configuration for smpp:
listen = smpp:10.3.0.150:5062
modparam("proto_smpp","db_url",
        "<mysql connection>")
modparam("proto_smpp", "smpp_port", 5062)
modparam("proto_smpp", "outbound_uri", "sip:10.3.0.150:5060")

Can you please indicate how you configured your side to have inbound towards you working ?

**Comment by johandeclercqdemocon** [comment]
or would the issue be that I have 2 transceivers ?

**Comment by volga629** [comment]
SMPP is peer to peer. Try set one connection at the time and try set system_id to smpp_site1 one and second smpp_site2

**Comment by johandeclercqdemocon** [comment]
That’s the thing.  

The system_id is for both links the same and so is pwd, system_type, addr_ton and addr_npi and data_coding (sorry but I can’t share the real info for obvious reasons).  So changing the system_id will not work. 

 

 

This is what the provider give me as info : 

“

*	Rule 1: The CUSTOMER Server Address initiates the SMPP session (via SMPP Bind request) to Server Address (Load Balancer): x.y.z.t on port 2775.
*	Rule 2: Our Server Addresses (a.b.c.d) initiates the SMPP session (via SMPP Bind request) to the CUSTOMER Server Address on port 5062

”

It’s the second inbound rule that gives the headache. 

 

Am I right that the inbound link needs to be defined as below ?

 

+----+--------------+-------------+------+-----------+----------+-------------+---------+---------+---------+---------+--------------+
| id | name         | ip          | port | system_id | password | system_type | src_ton | src_npi | dst_ton | dst_npi | session_type |
+----+--------------+-------------+------+-----------+----------+-------------+---------+---------+---------+---------+--------------+
|  1 | tralala        | 80.x.y.z| 2775 | BELOUT| smsin | OTT         |       1 |       1 |       1 |       1 |            1 |
|  2 | tralala INBOUND | 10.3.0.150  | 5062 | BELIN | smsout | OTT         |       1 |       1 |       1 |       1 |            1 |

 

BR,

**Comment by johandeclercqdemocon** [comment]
And this is the full debug 5 output (filtered on smpp)

Jul 29 18:07:09 hendrix opensips: DBG:core:load_module: loading module /data/opensips/lib64/opensips/modules/proto_smpp.so

Jul 29 18:07:09 hendrix opensips: DBG:core:set_mod_param_regex: proto_smpp matches module proto_smpp

Jul 29 18:07:09 hendrix opensips: DBG:core:set_mod_param_regex: found <db_url> in module proto_smpp [/data/opensips/lib64/opensips/modules/]

Jul 29 18:07:09 hendrix opensips: DBG:core:set_mod_param_regex: proto_smpp matches module proto_smpp

Jul 29 18:07:09 hendrix opensips: DBG:core:set_mod_param_regex: found <smpp_port> in module proto_smpp [/data/opensips/lib64/opensips/modules/]

Jul 29 18:07:09 hendrix opensips: DBG:core:set_mod_param_regex: proto_smpp matches module proto_smpp

Jul 29 18:07:09 hendrix opensips: DBG:core:set_mod_param_regex: found <outbound_uri> in module proto_smpp [/data/opensips/lib64/opensips/modules/]

Jul 29 18:07:09 hendrix opensips: DBG:core:find_cmd_export_t: found <send_smpp_message> in module proto_smpp [/data/opensips/lib64/opensips/modules/]

Jul 29 18:07:09 hendrix opensips[15049]:              smpp: 10.3.0.150 [10.3.0.150]:5062

Jul 29 18:07:09 hendrix opensips: DBG:core:socket2str: <smpp:10.3.0.150:5062>

Jul 29 18:07:09 hendrix /data/opensips/sbin/opensips[15071]: DBG:core:init_mod: initializing module proto_smpp

Jul 29 18:07:09 hendrix /data/opensips/sbin/opensips[15071]: INFO:proto_smpp:mod_init: initializing SMPP protocol

Jul 29 18:07:09 hendrix /data/opensips/sbin/opensips[15071]: DBG:core:fix_actions: fixing send_smpp_message, /data/opensips/etc/opensips/opensips.cfg:553

Jul 29 18:07:09 hendrix /data/opensips/sbin/opensips[15072]: DBG:core:init_mod_child: type=PROC_MODULE, rank=-2, module=proto_smpp

Jul 29 18:07:09 hendrix /data/opensips/sbin/opensips[15072]: INFO:proto_smpp:child_init: initializing child #-2

Jul 29 18:07:09 hendrix /data/opensips/sbin/opensips[15075]: DBG:core:init_mod_child: type=CHILD, rank=1, module=proto_smpp

Jul 29 18:07:09 hendrix /data/opensips/sbin/opensips[15075]: INFO:proto_smpp:child_init: initializing child #1

Jul 29 18:07:09 hendrix /data/opensips/sbin/opensips[15076]: DBG:core:init_mod_child: type=CHILD, rank=2, module=proto_smpp

Jul 29 18:07:09 hendrix /data/opensips/sbin/opensips[15076]: INFO:proto_smpp:child_init: initializing child #2

Jul 29 18:07:09 hendrix /data/opensips/sbin/opensips[15077]: DBG:core:init_mod_child: type=CHILD, rank=3, module=proto_smpp

Jul 29 18:07:09 hendrix /data/opensips/sbin/opensips[15077]: INFO:proto_smpp:child_init: initializing child #3

Jul 29 18:07:09 hendrix /data/opensips/sbin/opensips[15078]: DBG:core:init_mod_child: type=CHILD, rank=4, module=proto_smpp

Jul 29 18:07:09 hendrix /data/opensips/sbin/opensips[15078]: INFO:proto_smpp:child_init: initializing child #4

Jul 29 18:07:09 hendrix /data/opensips/sbin/opensips[15079]: DBG:core:init_mod_child: type=CHILD, rank=5, module=proto_smpp

Jul 29 18:07:09 hendrix /data/opensips/sbin/opensips[15079]: INFO:proto_smpp:child_init: initializing child #5

Jul 29 18:07:09 hendrix /data/opensips/sbin/opensips[15080]: DBG:core:init_mod_child: type=CHILD, rank=6, module=proto_smpp

Jul 29 18:07:09 hendrix /data/opensips/sbin/opensips[15080]: INFO:proto_smpp:child_init: initializing child #6

Jul 29 18:07:09 hendrix /data/opensips/sbin/opensips[15081]: DBG:core:init_mod_child: type=CHILD, rank=7, module=proto_smpp

Jul 29 18:07:09 hendrix /data/opensips/sbin/opensips[15081]: INFO:proto_smpp:child_init: initializing child #7

Jul 29 18:07:09 hendrix /data/opensips/sbin/opensips[15082]: DBG:core:init_mod_child: type=CHILD, rank=8, module=proto_smpp

Jul 29 18:07:09 hendrix /data/opensips/sbin/opensips[15082]: INFO:proto_smpp:child_init: initializing child #8

Jul 29 18:07:09 hendrix /data/opensips/sbin/opensips[15083]: DBG:core:init_mod_child: type=CHILD, rank=9, module=proto_smpp

Jul 29 18:07:09 hendrix /data/opensips/sbin/opensips[15083]: INFO:proto_smpp:child_init: initializing child #9

Jul 29 18:07:09 hendrix /data/opensips/sbin/opensips[15084]: DBG:core:init_mod_child: type=CHILD, rank=10, module=proto_smpp

Jul 29 18:07:09 hendrix /data/opensips/sbin/opensips[15084]: INFO:proto_smpp:child_init: initializing child #10

Jul 29 18:07:09 hendrix /data/opensips/sbin/opensips[15085]: DBG:core:init_mod_child: type=CHILD, rank=11, module=proto_smpp

Jul 29 18:07:09 hendrix /data/opensips/sbin/opensips[15085]: INFO:proto_smpp:child_init: initializing child #11

Jul 29 18:07:09 hendrix /data/opensips/sbin/opensips[15090]: DBG:core:init_mod_child: type=CHILD, rank=16, module=proto_smpp

Jul 29 18:07:09 hendrix /data/opensips/sbin/opensips[15087]: DBG:core:init_mod_child: type=CHILD, rank=13, module=proto_smpp

Jul 29 18:07:09 hendrix /data/opensips/sbin/opensips[15090]: INFO:proto_smpp:child_init: initializing child #16

Jul 29 18:07:09 hendrix /data/opensips/sbin/opensips[15087]: INFO:proto_smpp:child_init: initializing child #13

Jul 29 18:07:09 hendrix /data/opensips/sbin/opensips[15086]: DBG:core:init_mod_child: type=CHILD, rank=12, module=proto_smpp

Jul 29 18:07:09 hendrix /data/opensips/sbin/opensips[15086]: INFO:proto_smpp:child_init: initializing child #12

Jul 29 18:07:09 hendrix /data/opensips/sbin/opensips[15089]: DBG:core:init_mod_child: type=CHILD, rank=15, module=proto_smpp

Jul 29 18:07:09 hendrix /data/opensips/sbin/opensips[15088]: DBG:core:init_mod_child: type=CHILD, rank=14, module=proto_smpp

Jul 29 18:07:09 hendrix /data/opensips/sbin/opensips[15089]: INFO:proto_smpp:child_init: initializing child #15

Jul 29 18:07:09 hendrix /data/opensips/sbin/opensips[15088]: INFO:proto_smpp:child_init: initializing child #14

Jul 29 18:07:09 hendrix /data/opensips/sbin/opensips[15091]: DBG:core:init_mod_child: type=CHILD, rank=17, module=proto_smpp

Jul 29 18:07:09 hendrix /data/opensips/sbin/opensips[15092]: DBG:core:init_mod_child: type=CHILD, rank=18, module=proto_smpp

Jul 29 18:07:09 hendrix /data/opensips/sbin/opensips[15092]: INFO:proto_smpp:child_init: initializing child #18

Jul 29 18:07:09 hendrix /data/opensips/sbin/opensips[15071]: DBG:core:init_mod_child: type=PROC_MAIN, rank=0, module=proto_smpp

Jul 29 18:07:09 hendrix /data/opensips/sbin/opensips[15071]: INFO:proto_smpp:child_init: initializing child #0

Jul 29 18:07:09 hendrix /data/opensips/sbin/opensips[15093]: DBG:core:init_mod_child: type=CHILD, rank=19, module=proto_smpp

Jul 29 18:07:09 hendrix /data/opensips/sbin/opensips[15091]: INFO:proto_smpp:child_init: initializing child #17

Jul 29 18:07:09 hendrix /data/opensips/sbin/opensips[15093]: INFO:proto_smpp:child_init: initializing child #19

Jul 29 18:07:09 hendrix /data/opensips/sbin/opensips[15083]: DBG:proto_smpp:load_smpp_sessions_from_db: Number of rows in smpp table: 2

Jul 29 18:07:09 hendrix /data/opensips/sbin/opensips[15083]: DBG:proto_smpp:smpp_session_new: Added SMSC 0x7f379d8107c8

Jul 29 18:07:09 hendrix /data/opensips/sbin/opensips[15083]: DBG:proto_smpp:smpp_session_new: Added INBOUND SMSC 0x7f379d8108b0

Jul 29 18:07:09 hendrix /data/opensips/sbin/opensips[15083]: INFO:proto_smpp:load_smpp_sessions_from_db: Loaded 2 SMSc servers

Jul 29 18:07:09 hendrix /data/opensips/sbin/opensips[15083]: INFO:proto_smpp:send_bind: binding session with system_id "BELMO"

Jul 29 18:07:09 hendrix /data/opensips/sbin/opensips[15083]: INFO:proto_smpp:smpp_conn_init: smpp_conn_init called

Jul 29 18:07:09 hendrix /data/opensips/sbin/opensips[15083]: DBG:proto_smpp:send_bind: sent 43 bytes on smpp connection 0x7f379d8109a0

Jul 29 18:07:09 hendrix /data/opensips/sbin/opensips[15083]: DBG:proto_smpp:bind_session: succsessfully bound INBOUND

Jul 29 18:07:09 hendrix /data/opensips/sbin/opensips[15083]: INFO:proto_smpp:send_bind: binding session with system_id "BELMO"

Jul 29 18:07:09 hendrix /data/opensips/sbin/opensips[15094]: INFO:proto_smpp:smpp_conn_init: smpp_conn_init called

Jul 29 18:07:09 hendrix /data/opensips/sbin/opensips[15085]: DBG:proto_smpp:smpp_read_req: Using the global ( per process ) buff

Jul 29 18:07:09 hendrix /data/opensips/sbin/opensips[15085]: DBG:proto_smpp:smpp_parse_headers: received a complete message

Jul 29 18:07:09 hendrix /data/opensips/sbin/opensips[15085]: DBG:proto_smpp:smpp_handle_req: completely received a message

Jul 29 18:07:09 hendrix /data/opensips/sbin/opensips[15085]: DBG:proto_smpp:smpp_handle_req: Nothing more to read on TCP conn 0x7f379d810b48, currently in state 0

Jul 29 18:07:09 hendrix /data/opensips/sbin/opensips[15085]: DBG:proto_smpp:handle_smpp_msg: Received SMPP command 00000009

Jul 29 18:07:09 hendrix /data/opensips/sbin/opensips[15085]: DBG:proto_smpp:handle_bind_transceiver_cmd: Received bind_transceiver command

Jul 29 18:07:09 hendrix /data/opensips/sbin/opensips[15085]: ERROR:proto_smpp:handle_bind_transceiver_cmd: NULL params

Jul 29 18:07:09 hendrix /data/opensips/sbin/opensips[15085]: DBG:proto_smpp:smpp_read_req: tcp_read_req end

Jul 29 18:07:09 hendrix /data/opensips/sbin/opensips[15083]: INFO:proto_smpp:smpp_conn_init: smpp_conn_init called

Jul 29 18:07:09 hendrix /data/opensips/sbin/opensips[15083]: DBG:proto_smpp:send_bind: sent 43 bytes on smpp connection 0x7f379d811dc8

Jul 29 18:07:09 hendrix /data/opensips/sbin/opensips[15083]: DBG:proto_smpp:bind_session: succsessfully bound BICS

Jul 29 18:07:11 hendrix /data/opensips/sbin/opensips[15086]: DBG:proto_smpp:smpp_read_req: Using the global ( per process ) buff

Jul 29 18:07:11 hendrix /data/opensips/sbin/opensips[15086]: DBG:proto_smpp:smpp_parse_headers: received a complete message

Jul 29 18:07:11 hendrix /data/opensips/sbin/opensips[15086]: DBG:proto_smpp:smpp_handle_req: completely received a message

Jul 29 18:07:11 hendrix /data/opensips/sbin/opensips[15086]: DBG:proto_smpp:smpp_handle_req: Nothing more to read on TCP conn 0x7f379d811dc8, currently in state 0

Jul 29 18:07:11 hendrix /data/opensips/sbin/opensips[15086]: DBG:proto_smpp:handle_smpp_msg: Received SMPP command 80000009

Jul 29 18:07:11 hendrix /data/opensips/sbin/opensips[15086]: DBG:proto_smpp:handle_bind_transceiver_resp_cmd: Received bind_transceiver_resp command

Jul 29 18:07:11 hendrix /data/opensips/sbin/opensips[15086]: INFO:proto_smpp:handle_bind_transceiver_resp_cmd: Successfully bound transceiver ""

Jul 29 18:07:11 hendrix /data/opensips/sbin/opensips[15086]: DBG:proto_smpp:smpp_read_req: tcp_read_req end

Jul 29 18:07:12 hendrix /data/opensips/sbin/opensips[15094]: INFO:proto_smpp:smpp_conn_init: smpp_conn_init called

Jul 29 18:07:14 hendrix /data/opensips/sbin/opensips[15085]: DBG:proto_smpp:smpp_read_req: Using the global ( per process ) buff

Jul 29 18:07:14 hendrix /data/opensips/sbin/opensips[15085]: DBG:proto_smpp:smpp_parse_headers: received a complete message

Jul 29 18:07:14 hendrix /data/opensips/sbin/opensips[15085]: DBG:proto_smpp:smpp_handle_req: completely received a message

Jul 29 18:07:14 hendrix /data/opensips/sbin/opensips[15085]: DBG:proto_smpp:smpp_handle_req: Nothing more to read on TCP conn 0x7f379d810b48, currently in state 0

Jul 29 18:07:14 hendrix /data/opensips/sbin/opensips[15085]: DBG:proto_smpp:handle_smpp_msg: Received SMPP command 00000015

Jul 29 18:07:14 hendrix /data/opensips/sbin/opensips[15085]: DBG:proto_smpp:handle_enquire_link_cmd: Received enquire_link command

Jul 29 18:07:14 hendrix /data/opensips/sbin/opensips[15085]: DBG:proto_smpp:smpp_read_req: tcp_read_req end

Jul 29 18:07:14 hendrix /data/opensips/sbin/opensips[15086]: DBG:proto_smpp:smpp_read_req: Using the global ( per process ) buff

Jul 29 18:07:14 hendrix /data/opensips/sbin/opensips[15086]: DBG:proto_smpp:smpp_parse_headers: received a complete message

Jul 29 18:07:14 hendrix /data/opensips/sbin/opensips[15086]: DBG:proto_smpp:smpp_handle_req: completely received a message

Jul 29 18:07:14 hendrix /data/opensips/sbin/opensips[15086]: DBG:proto_smpp:smpp_handle_req: Nothing more to read on TCP conn 0x7f379d811dc8, currently in state 0

Jul 29 18:07:14 hendrix /data/opensips/sbin/opensips[15086]: DBG:proto_smpp:handle_smpp_msg: Received SMPP command 80000015

Jul 29 18:07:14 hendrix /data/opensips/sbin/opensips[15086]: DBG:proto_smpp:handle_enquire_link_resp_cmd: Received enquire_link_resp command

Jul 29 18:07:14 hendrix /data/opensips/sbin/opensips[15086]: DBG:proto_smpp:smpp_read_req: tcp_read_req end

Jul 29 18:07:14 hendrix /data/opensips/sbin/opensips[15087]: DBG:proto_smpp:smpp_read_req: Using the global ( per process ) buff

Jul 29 18:07:14 hendrix /data/opensips/sbin/opensips[15087]: DBG:proto_smpp:smpp_parse_headers: received a complete message

Jul 29 18:07:14 hendrix /data/opensips/sbin/opensips[15087]: DBG:proto_smpp:smpp_handle_req: completely received a message

Jul 29 18:07:14 hendrix /data/opensips/sbin/opensips[15087]: DBG:proto_smpp:smpp_handle_req: Nothing more to read on TCP conn 0x7f379d8137f8, currently in state 0

Jul 29 18:07:14 hendrix /data/opensips/sbin/opensips[15087]: DBG:proto_smpp:handle_smpp_msg: Received SMPP command 00000009

Jul 29 18:07:14 hendrix /data/opensips/sbin/opensips[15087]: DBG:proto_smpp:handle_bind_transceiver_cmd: Received bind_transceiver command

Jul 29 18:07:14 hendrix /data/opensips/sbin/opensips[15087]: ERROR:proto_smpp:handle_bind_transceiver_cmd: NULL params

Jul 29 18:07:14 hendrix /data/opensips/sbin/opensips[15087]: DBG:proto_smpp:smpp_read_req: tcp_read_req end

Jul 29 18:07:19 hendrix /data/opensips/sbin/opensips[15085]: DBG:proto_smpp:smpp_read_req: Using the global ( per process ) buff

Jul 29 18:07:19 hendrix /data/opensips/sbin/opensips[15085]: DBG:proto_smpp:smpp_parse_headers: received a complete message

Jul 29 18:07:19 hendrix /data/opensips/sbin/opensips[15085]: DBG:proto_smpp:smpp_handle_req: completely received a message

Jul 29 18:07:19 hendrix /data/opensips/sbin/opensips[15085]: DBG:proto_smpp:smpp_handle_req: Nothing more to read on TCP conn 0x7f379d810b48, currently in state 0

Jul 29 18:07:19 hendrix /data/opensips/sbin/opensips[15085]: DBG:proto_smpp:handle_smpp_msg: Received SMPP command 00000015

Jul 29 18:07:19 hendrix /data/opensips/sbin/opensips[15085]: DBG:proto_smpp:handle_enquire_link_cmd: Received enquire_link command

Jul 29 18:07:19 hendrix /data/opensips/sbin/opensips[15085]: DBG:proto_smpp:smpp_read_req: tcp_read_req end

Jul 29 18:07:19 hendrix /data/opensips/sbin/opensips[15086]: DBG:proto_smpp:smpp_read_req: Using the global ( per process ) buff

Jul 29 18:07:19 hendrix /data/opensips/sbin/opensips[15086]: DBG:proto_smpp:smpp_parse_headers: received a complete message

Jul 29 18:07:19 hendrix /data/opensips/sbin/opensips[15086]: DBG:proto_smpp:smpp_handle_req: completely received a message

Jul 29 18:07:19 hendrix /data/opensips/sbin/opensips[15086]: DBG:proto_smpp:smpp_handle_req: Nothing more to read on TCP conn 0x7f379d811dc8, currently in state 0

Jul 29 18:07:19 hendrix /data/opensips/sbin/opensips[15086]: DBG:proto_smpp:handle_smpp_msg: Received SMPP command 80000015

Jul 29 18:07:19 hendrix /data/opensips/sbin/opensips[15086]: DBG:proto_smpp:handle_enquire_link_resp_cmd: Received enquire_link_resp command

Jul 29 18:07:19 hendrix /data/opensips/sbin/opensips[15086]: DBG:proto_smpp:smpp_read_req: tcp_read_req end

Jul 29 18:07:25 hendrix /data/opensips/sbin/opensips[15085]: DBG:proto_smpp:smpp_read_req: Using the global ( per process ) buff

Jul 29 18:07:25 hendrix /data/opensips/sbin/opensips[15085]: DBG:proto_smpp:smpp_parse_headers: received a complete message

Jul 29 18:07:25 hendrix /data/opensips/sbin/opensips[15085]: DBG:proto_smpp:smpp_handle_req: completely received a message

Jul 29 18:07:25 hendrix /data/opensips/sbin/opensips[15085]: DBG:proto_smpp:smpp_handle_req: Nothing more to read on TCP conn 0x7f379d810b48, currently in state 0

Jul 29 18:07:25 hendrix /data/opensips/sbin/opensips[15085]: DBG:proto_smpp:handle_smpp_msg: Received SMPP command 00000015

Jul 29 18:07:25 hendrix /data/opensips/sbin/opensips[15085]: DBG:proto_smpp:handle_enquire_link_cmd: Received enquire_link command

Jul 29 18:07:25 hendrix /data/opensips/sbin/opensips[15085]: DBG:proto_smpp:smpp_read_req: tcp_read_req end

Jul 29 18:07:25 hendrix /data/opensips/sbin/opensips[15086]: DBG:proto_smpp:smpp_read_req: Using the global ( per process ) buff

Jul 29 18:07:25 hendrix /data/opensips/sbin/opensips[15086]: DBG:proto_smpp:smpp_parse_headers: received a complete message

Jul 29 18:07:25 hendrix /data/opensips/sbin/opensips[15086]: DBG:proto_smpp:smpp_handle_req: completely received a message

Jul 29 18:07:25 hendrix /data/opensips/sbin/opensips[15086]: DBG:proto_smpp:smpp_handle_req: Nothing more to read on TCP conn 0x7f379d811dc8, currently in state 0

Jul 29 18:07:25 hendrix /data/opensips/sbin/opensips[15086]: DBG:proto_smpp:handle_smpp_msg: Received SMPP command 80000015

Jul 29 18:07:25 hendrix /data/opensips/sbin/opensips[15086]: DBG:proto_smpp:handle_enquire_link_resp_cmd: Received enquire_link_resp command

Jul 29 18:07:25 hendrix /data/opensips/sbin/opensips[15086]: DBG:proto_smpp:smpp_read_req: tcp_read_req end

Jul 29 18:07:30 hendrix /data/opensips/sbin/opensips[15085]: DBG:proto_smpp:smpp_read_req: Using the global ( per process ) buff

Jul 29 18:07:30 hendrix /data/opensips/sbin/opensips[15085]: DBG:proto_smpp:smpp_parse_headers: received a complete message

Jul 29 18:07:30 hendrix /data/opensips/sbin/opensips[15085]: DBG:proto_smpp:smpp_handle_req: completely received a message

Jul 29 18:07:30 hendrix /data/opensips/sbin/opensips[15085]: DBG:proto_smpp:smpp_handle_req: Nothing more to read on TCP conn 0x7f379d810b48, currently in state 0

Jul 29 18:07:30 hendrix /data/opensips/sbin/opensips[15085]: DBG:proto_smpp:handle_smpp_msg: Received SMPP command 00000015

Jul 29 18:07:30 hendrix /data/opensips/sbin/opensips[15085]: DBG:proto_smpp:handle_enquire_link_cmd: Received enquire_link command

Jul 29 18:07:30 hendrix /data/opensips/sbin/opensips[15085]: DBG:proto_smpp:smpp_read_req: tcp_read_req end

Jul 29 18:07:30 hendrix /data/opensips/sbin/opensips[15086]: DBG:proto_smpp:smpp_read_req: Using the global ( per process ) buff

Jul 29 18:07:30 hendrix /data/opensips/sbin/opensips[15086]: DBG:proto_smpp:smpp_parse_headers: received a complete message

Jul 29 18:07:30 hendrix /data/opensips/sbin/opensips[15086]: DBG:proto_smpp:smpp_handle_req: completely received a message

Jul 29 18:07:30 hendrix /data/opensips/sbin/opensips[15086]: DBG:proto_smpp:smpp_handle_req: Nothing more to read on TCP conn 0x7f379d811dc8, currently in state 0

Jul 29 18:07:30 hendrix /data/opensips/sbin/opensips[15086]: DBG:proto_smpp:handle_smpp_msg: Received SMPP command 80000015

Jul 29 18:07:30 hendrix /data/opensips/sbin/opensips[15086]: DBG:proto_smpp:handle_enquire_link_resp_cmd: Received enquire_link_resp command

Jul 29 18:07:30 hendrix /data/opensips/sbin/opensips[15086]: DBG:proto_smpp:smpp_read_req: tcp_read_req end

Jul 29 18:07:35 hendrix /data/opensips/sbin/opensips[15085]: DBG:proto_smpp:smpp_read_req: Using the global ( per process ) buff

Jul 29 18:07:35 hendrix /data/opensips/sbin/opensips[15085]: DBG:proto_smpp:smpp_parse_headers: received a complete message

Jul 29 18:07:35 hendrix /data/opensips/sbin/opensips[15085]: DBG:proto_smpp:smpp_handle_req: completely received a message

Jul 29 18:07:35 hendrix /data/opensips/sbin/opensips[15085]: DBG:proto_smpp:smpp_handle_req: Nothing more to read on TCP conn 0x7f379d810b48, currently in state 0

Jul 29 18:07:35 hendrix /data/opensips/sbin/opensips[15085]: DBG:proto_smpp:handle_smpp_msg: Received SMPP command 00000015

Jul 29 18:07:35 hendrix /data/opensips/sbin/opensips[15085]: DBG:proto_smpp:handle_enquire_link_cmd: Received enquire_link command

Jul 29 18:07:35 hendrix /data/opensips/sbin/opensips[15085]: DBG:proto_smpp:smpp_read_req: tcp_read_req end

Jul 29 18:07:35 hendrix /data/opensips/sbin/opensips[15086]: DBG:proto_smpp:smpp_read_req: Using the global ( per process ) buff

Jul 29 18:07:35 hendrix /data/opensips/sbin/opensips[15086]: DBG:proto_smpp:smpp_parse_headers: received a complete message

Jul 29 18:07:35 hendrix /data/opensips/sbin/opensips[15086]: DBG:proto_smpp:smpp_handle_req: completely received a message

Jul 29 18:07:35 hendrix /data/opensips/sbin/opensips[15086]: DBG:proto_smpp:smpp_handle_req: Nothing more to read on TCP conn 0x7f379d811dc8, currently in state 0

Jul 29 18:07:35 hendrix /data/opensips/sbin/opensips[15086]: DBG:proto_smpp:handle_smpp_msg: Received SMPP command 80000015

Jul 29 18:07:35 hendrix /data/opensips/sbin/opensips[15086]: DBG:proto_smpp:handle_enquire_link_resp_cmd: Received enquire_link_resp command

Jul 29 18:07:35 hendrix /data/opensips/sbin/opensips[15086]: DBG:proto_smpp:smpp_read_req: tcp_read_req end

Jul 29 18:07:40 hendrix /data/opensips/sbin/opensips[15085]: DBG:proto_smpp:smpp_read_req: Using the global ( per process ) buff

Jul 29 18:07:40 hendrix /data/opensips/sbin/opensips[15085]: DBG:proto_smpp:smpp_parse_headers: received a complete message

Jul 29 18:07:40 hendrix /data/opensips/sbin/opensips[15085]: DBG:proto_smpp:smpp_handle_req: completely received a message

Jul 29 18:07:40 hendrix /data/opensips/sbin/opensips[15085]: DBG:proto_smpp:smpp_handle_req: Nothing more to read on TCP conn 0x7f379d810b48, currently in state 0

Jul 29 18:07:40 hendrix /data/opensips/sbin/opensips[15085]: DBG:proto_smpp:handle_smpp_msg: Received SMPP command 00000015

Jul 29 18:07:40 hendrix /data/opensips/sbin/opensips[15085]: DBG:proto_smpp:handle_enquire_link_cmd: Received enquire_link command

Jul 29 18:07:40 hendrix /data/opensips/sbin/opensips[15085]: DBG:proto_smpp:smpp_read_req: tcp_read_req end

Jul 29 18:07:40 hendrix /data/opensips/sbin/opensips[15086]: DBG:proto_smpp:smpp_read_req: Using the global ( per process ) buff

Jul 29 18:07:40 hendrix /data/opensips/sbin/opensips[15086]: DBG:proto_smpp:smpp_parse_headers: received a complete message

Jul 29 18:07:40 hendrix /data/opensips/sbin/opensips[15086]: DBG:proto_smpp:smpp_handle_req: completely received a message

Jul 29 18:07:40 hendrix /data/opensips/sbin/opensips[15086]: DBG:proto_smpp:smpp_handle_req: Nothing more to read on TCP conn 0x7f379d811dc8, currently in state 0

Jul 29 18:07:40 hendrix /data/opensips/sbin/opensips[15086]: DBG:proto_smpp:handle_smpp_msg: Received SMPP command 80000015

Jul 29 18:07:40 hendrix /data/opensips/sbin/opensips[15086]: DBG:proto_smpp:handle_enquire_link_resp_cmd: Received enquire_link_resp command

Jul 29 18:07:40 hendrix /data/opensips/sbin/opensips[15086]: DBG:proto_smpp:smpp_read_req: tcp_read_req end

Jul 29 18:07:42 hendrix /data/opensips/sbin/opensips[15087]: DBG:proto_smpp:smpp_read_req: Using the global ( per process ) buff

Jul 29 18:07:42 hendrix /data/opensips/sbin/opensips[15087]: DBG:proto_smpp:smpp_read_req: EOF received

Jul 29 18:07:42 hendrix /data/opensips/sbin/opensips[15094]: INFO:proto_smpp:smpp_conn_clean: smpp_conn_clean called

Jul 29 18:07:45 hendrix /data/opensips/sbin/opensips[15085]: DBG:proto_smpp:smpp_read_req: Using the global ( per process ) buff

Jul 29 18:07:45 hendrix /data/opensips/sbin/opensips[15085]: DBG:proto_smpp:smpp_parse_headers: received a complete message

Jul 29 18:07:45 hendrix /data/opensips/sbin/opensips[15085]: DBG:proto_smpp:smpp_handle_req: completely received a message

Jul 29 18:07:45 hendrix /data/opensips/sbin/opensips[15085]: DBG:proto_smpp:smpp_handle_req: Nothing more to read on TCP conn 0x7f379d810b48, currently in state 0

Jul 29 18:07:45 hendrix /data/opensips/sbin/opensips[15085]: DBG:proto_smpp:handle_smpp_msg: Received SMPP command 00000015

Jul 29 18:07:45 hendrix /data/opensips/sbin/opensips[15085]: DBG:proto_smpp:handle_enquire_link_cmd: Received enquire_link command

Jul 29 18:07:45 hendrix /data/opensips/sbin/opensips[15085]: DBG:proto_smpp:smpp_read_req: tcp_read_req end

Jul 29 18:07:45 hendrix /data/opensips/sbin/opensips[15086]: DBG:proto_smpp:smpp_read_req: Using the global ( per process ) buff

Jul 29 18:07:45 hendrix /data/opensips/sbin/opensips[15086]: DBG:proto_smpp:smpp_parse_headers: received a complete message

Jul 29 18:07:45 hendrix /data/opensips/sbin/opensips[15086]: DBG:proto_smpp:smpp_handle_req: completely received a message

Jul 29 18:07:45 hendrix /data/opensips/sbin/opensips[15086]: DBG:proto_smpp:smpp_handle_req: Nothing more to read on TCP conn 0x7f379d811dc8, currently in state 0

Jul 29 18:07:45 hendrix /data/opensips/sbin/opensips[15086]: DBG:proto_smpp:handle_smpp_msg: Received SMPP command 80000015

Jul 29 18:07:45 hendrix /data/opensips/sbin/opensips[15086]: DBG:proto_smpp:handle_enquire_link_resp_cmd: Received enquire_link_resp command

Jul 29 18:07:45 hendrix /data/opensips/sbin/opensips[15086]: DBG:proto_smpp:smpp_read_req: tcp_read_req end

Jul 29 18:07:47 hendrix /data/opensips/sbin/opensips[15094]: INFO:proto_smpp:smpp_conn_init: smpp_conn_init called

Jul 29 18:07:49 hendrix /data/opensips/sbin/opensips[15087]: DBG:proto_smpp:smpp_read_req: Using the global ( per process ) buff

Jul 29 18:07:49 hendrix /data/opensips/sbin/opensips[15087]: DBG:proto_smpp:smpp_parse_headers: received a complete message

Jul 29 18:07:49 hendrix /data/opensips/sbin/opensips[15087]: DBG:proto_smpp:smpp_handle_req: completely received a message

Jul 29 18:07:49 hendrix /data/opensips/sbin/opensips[15087]: DBG:proto_smpp:smpp_handle_req: Nothing more to read on TCP conn 0x7f379d8137f8, currently in state 0

Jul 29 18:07:49 hendrix /data/opensips/sbin/opensips[15087]: DBG:proto_smpp:handle_smpp_msg: Received SMPP command 00000009

Jul 29 18:07:49 hendrix /data/opensips/sbin/opensips[15087]: DBG:proto_smpp:handle_bind_transceiver_cmd: Received bind_transceiver command

Jul 29 18:07:49 hendrix /data/opensips/sbin/opensips[15087]: ERROR:proto_smpp:handle_bind_transceiver_cmd: NULL params

Jul 29 18:07:49 hendrix /data/opensips/sbin/opensips[15087]: DBG:proto_smpp:smpp_read_req: tcp_read_req end

Jul 29 18:07:50 hendrix /data/opensips/sbin/opensips[15085]: DBG:proto_smpp:smpp_read_req: Using the global ( per process ) buff

Jul 29 18:07:50 hendrix /data/opensips/sbin/opensips[15085]: DBG:proto_smpp:smpp_parse_headers: received a complete message

Jul 29 18:07:50 hendrix /data/opensips/sbin/opensips[15085]: DBG:proto_smpp:smpp_handle_req: completely received a message

Jul 29 18:07:50 hendrix /data/opensips/sbin/opensips[15085]: DBG:proto_smpp:smpp_handle_req: Nothing more to read on TCP conn 0x7f379d810b48, currently in state 0

Jul 29 18:07:50 hendrix /data/opensips/sbin/opensips[15085]: DBG:proto_smpp:handle_smpp_msg: Received SMPP command 00000015

Jul 29 18:07:50 hendrix /data/opensips/sbin/opensips[15085]: DBG:proto_smpp:handle_enquire_link_cmd: Received enquire_link command

Jul 29 18:07:50 hendrix /data/opensips/sbin/opensips[15085]: DBG:proto_smpp:smpp_read_req: tcp_read_req end

Jul 29 18:07:50 hendrix /data/opensips/sbin/opensips[15086]: DBG:proto_smpp:smpp_read_req: Using the global ( per process ) buff

Jul 29 18:07:50 hendrix /data/opensips/sbin/opensips[15086]: DBG:proto_smpp:smpp_parse_headers: received a complete message

Jul 29 18:07:50 hendrix /data/opensips/sbin/opensips[15086]: DBG:proto_smpp:smpp_handle_req: completely received a message

Jul 29 18:07:50 hendrix /data/opensips/sbin/opensips[15086]: DBG:proto_smpp:smpp_handle_req: Nothing more to read on TCP conn 0x7f379d811dc8, currently in state 0

Jul 29 18:07:50 hendrix /data/opensips/sbin/opensips[15086]: DBG:proto_smpp:handle_smpp_msg: Received SMPP command 80000015

Jul 29 18:07:50 hendrix /data/opensips/sbin/opensips[15086]: DBG:proto_smpp:handle_enquire_link_resp_cmd: Received enquire_link_resp command

Jul 29 18:07:50 hendrix /data/opensips/sbin/opensips[15086]: DBG:proto_smpp:smpp_read_req: tcp_read_req end

Jul 29 18:07:55 hendrix /data/opensips/sbin/opensips[15085]: DBG:proto_smpp:smpp_read_req: Using the global ( per process ) buff

Jul 29 18:07:55 hendrix /data/opensips/sbin/opensips[15085]: DBG:proto_smpp:smpp_parse_headers: received a complete message

Jul 29 18:07:55 hendrix /data/opensips/sbin/opensips[15085]: DBG:proto_smpp:smpp_handle_req: completely received a message

Jul 29 18:07:55 hendrix /data/opensips/sbin/opensips[15085]: DBG:proto_smpp:smpp_handle_req: Nothing more to read on TCP conn 0x7f379d810b48, currently in state 0

Jul 29 18:07:55 hendrix /data/opensips/sbin/opensips[15085]: DBG:proto_smpp:handle_smpp_msg: Received SMPP command 00000015

Jul 29 18:07:55 hendrix /data/opensips/sbin/opensips[15085]: DBG:proto_smpp:handle_enquire_link_cmd: Received enquire_link command

Jul 29 18:07:55 hendrix /data/opensips/sbin/opensips[15085]: DBG:proto_smpp:smpp_read_req: tcp_read_req end

Jul 29 18:07:55 hendrix /data/opensips/sbin/opensips[15086]: DBG:proto_smpp:smpp_read_req: Using the global ( per process ) buff

Jul 29 18:07:55 hendrix /data/opensips/sbin/opensips[15086]: DBG:proto_smpp:smpp_parse_headers: received a complete message

Jul 29 18:07:55 hendrix /data/opensips/sbin/opensips[15086]: DBG:proto_smpp:smpp_handle_req: completely received a message

Jul 29 18:07:55 hendrix /data/opensips/sbin/opensips[15086]: DBG:proto_smpp:smpp_handle_req: Nothing more to read on TCP conn 0x7f379d811dc8, currently in state 0

Jul 29 18:07:55 hendrix /data/opensips/sbin/opensips[15086]: DBG:proto_smpp:handle_smpp_msg: Received SMPP command 80000015

Jul 29 18:07:55 hendrix /data/opensips/sbin/opensips[15086]: DBG:proto_smpp:handle_enquire_link_resp_cmd: Received enquire_link_resp command

Jul 29 18:07:55 hendrix /data/opensips/sbin/opensips[15086]: DBG:proto_smpp:smpp_read_req: tcp_read_req end

Jul 29 18:08:00 hendrix /data/opensips/sbin/opensips[15085]: DBG:proto_smpp:smpp_read_req: Using the global ( per process ) buff

Jul 29 18:08:00 hendrix /data/opensips/sbin/opensips[15085]: DBG:proto_smpp:smpp_parse_headers: received a complete message

Jul 29 18:08:00 hendrix /data/opensips/sbin/opensips[15085]: DBG:proto_smpp:smpp_handle_req: completely received a message

Jul 29 18:08:00 hendrix /data/opensips/sbin/opensips[15085]: DBG:proto_smpp:smpp_handle_req: Nothing more to read on TCP conn 0x7f379d810b48, currently in state 0

Jul 29 18:08:00 hendrix /data/opensips/sbin/opensips[15085]: DBG:proto_smpp:handle_smpp_msg: Received SMPP command 00000015

Jul 29 18:08:00 hendrix /data/opensips/sbin/opensips[15085]: DBG:proto_smpp:handle_enquire_link_cmd: Received enquire_link command

Jul 29 18:08:00 hendrix /data/opensips/sbin/opensips[15085]: DBG:proto_smpp:smpp_read_req: tcp_read_req end

Jul 29 18:08:00 hendrix /data/opensips/sbin/opensips[15086]: DBG:proto_smpp:smpp_read_req: Using the global ( per process ) buff

Jul 29 18:08:00 hendrix /data/opensips/sbin/opensips[15086]: DBG:proto_smpp:smpp_parse_headers: received a complete message

Jul 29 18:08:00 hendrix /data/opensips/sbin/opensips[15086]: DBG:proto_smpp:smpp_handle_req: completely received a message

Jul 29 18:08:00 hendrix /data/opensips/sbin/opensips[15086]: DBG:proto_smpp:smpp_handle_req: Nothing more to read on TCP conn 0x7f379d811dc8, currently in state 0

Jul 29 18:08:00 hendrix /data/opensips/sbin/opensips[15086]: DBG:proto_smpp:handle_smpp_msg: Received SMPP command 80000015

Jul 29 18:08:00 hendrix /data/opensips/sbin/opensips[15086]: DBG:proto_smpp:handle_enquire_link_resp_cmd: Received enquire_link_resp command

Jul 29 18:08:00 hendrix /data/opensips/sbin/opensips[15086]: DBG:proto_smpp:smpp_read_req: tcp_read_req end

**Comment by volga629** [comment]
The more I am looking on debug the more I think use 27745 same listener and define inbound stream as respond only 


```
Session Type - Specifies what type of session should be used to connecto th the SMSc. Possible values are:

1 - Transciever

2 - Transmitter

3 - Receiver

4 - Outbind

Default value is 1 - Transciever.
```

**Comment by johandeclercqdemocon** [comment]
The debug log is not very clear.... T66t

**Comment by johandeclercqdemocon** [comment]
What types do you set in dB volga?

**Comment by volga629** [comment]
toward provider 2 - Transmitter to accept bind 3 - Receiver

**Comment by johandeclercqdemocon** [comment]
Okay and my config seems correct to you?

**Comment by johandeclercqdemocon** [comment]
tomorrow I will try with changing my links to receiver and transmitter.
Will let you know the result.

BR,

Op di 30 jul. 2019 om 16:17 schreef volga629 <notifications@github.com>:
